id,organization_id,accessibility,admin_emails,alternate_name,description,email,languages,latitude,longitude,name,transportation,virtual,website
1,1,,,,No description provided,,,,,"Headquarters, Farm on Putah Creek",,false,
2,1,,,,No description provided,,,,,Office At Park Moderns,,false,
3,2,,,,No description provided,,,,,Downtown Chico Municipal Building,,false,
4,3,,,,No description provided,,,,,Main Office,,false,
5,4,,,,No description provided,,,,,Administrative Office,,false,
6,5,,,,No description provided,,,,,Arden Office,,false,
7,6,,,,No description provided,,,,,"1435 River Park Drive, Sacramento, CA 95815",,false,
8,7,,,,No description provided,,,,,"Power Inn Alliance is a Property and Business Improvement District (PBID), located in the southeastern quadrant of Sacramento. The Alliance is similar to a chamber of commerce in that we are the business advocate and community spokesperson for the entire area.",,false,
9,8,,,,No description provided,,,,,Sierra College,,false,
10,8,,,,No description provided,,,,,Sierra College Nevada County Campus,,false,
11,8,,,,No description provided,,,,,Sierra College Tahoe Truckee Campus,,false,
12,9,,,,No description provided,,,,,Sacramento,,true,
13,10,,,,No description provided,,,,,3725 Marysville Blvd Sacramento Ca 9538,,false,
14,10,,,,No description provided,,,,,South Sacramento Urban League,,false,
15,11,,,,No description provided,,,,,"Roseville, California",,false,
16,12,,,,No description provided,,,,,U. S. Small Business Administration,,false,
17,12,,,,No description provided,,,,,Northeastern California SBDC at Butte College,,false,
18,12,,,,No description provided,,,,,Northeastern California SBDC Capital Region,,false,
19,12,,,,No description provided,,,,,Northeastern California SBDC Siskiyou Economic Develoipment Council,,false,
20,12,,,,No description provided,,,,,Northeastern California SBDC at Sierra Business Council,,false,
21,13,,,,No description provided,,,,,2320 Broadway,,false,
22,14,,,,No description provided,,,,,Headquarters,,false,
23,14,,,,No description provided,,,,,Pacoima Entrepreneur Center,,false,
24,14,,,,No description provided,,,,,West Valley BusinessSource Center,,false,
25,15,,,,No description provided,,,,,Main Office,,false,
26,16,,,,No description provided,,,,,Main Office,,false,
27,17,,,,No description provided,,,,,"1000 Sunset Blvd., Suite 105, Rocklin, CA  95765",,false,
28,18,,,,No description provided,,,,,925 Del Paso Blvd,,false,
29,19,,,,No description provided,,,,,Sacramento County,,false,
30,20,,,,No description provided,,,,,"1430 East Avenue, Suite 4A, Chico, CA 95926",,false,
31,21,,,,No description provided,,,,,Main Office,,false,
32,22,,,,No description provided,,,,,Old Town Sacramento - Univ of San Francisco building,,false,
33,23,,,,No description provided,,,,,Bldg A next to the flagpole,,false,
34,24,,,,No description provided,,,,,Main Office,,false,
35,25,,,,No description provided,,,,,Program Founder Office,,false,
36,26,,,,No description provided,,,,,1527 I Street,,false,
37,27,,,,No description provided,,,,,CTE Building,,false,
38,28,,,,No description provided,,,,,City Hall,,false,
39,29,,,,No description provided,,,,,10183 Truckee Airport Rd,,false,
40,29,,,,No description provided,,,,,Economic Resource Council,,false,
41,30,,,,No description provided,,,,,Main Office,,false,
42,31,,,,No description provided,,,,,Administrative Offices,,false,
43,31,,,,No description provided,,,,,Sacramento Regional Transit Customer Advocacy,,false,
44,32,,,,No description provided,,,,,Headquarters,,false,
45,33,,,,No description provided,,,,,Natomas,,false,
46,33,,,,No description provided,,,,,Rancho Cordova,,false,
47,33,,,,No description provided,,,,,Rocklin,,false,
48,33,,,,No description provided,,,,,Elk Grove,,false,
49,33,,,,No description provided,,,,,Chico,,false,
50,34,,,,No description provided,,,,,Los Rios CCD  Workforce and Economic Development Center,,false,
51,35,,,,No description provided,,,,,California Department of General Services,,false,
52,36,,,,id ligula suspendisse ornare consequat lectus in est risus auctor sed tristique in tempus sit amet sem,,,,,8592 Valley Edge Plaza,,false,
53,36,,,,id ligula suspendisse ornare consequat lectus in est risus auctor sed tristique in tempus sit amet sem,,,,,5319 Price Ave,,false,
54,36,,,,elementum pellentesque quisque porta volutpat erat quisque erat eros viverra eget congue eget semper rutrum nulla nunc,,,,,3035 Mulvany Pl,,false,
55,37,,,,praesent blandit nam nulla integer pede justo lacinia eget tincidunt eget tempus vel pede morbi porttitor lorem id ligula,,,,,41436 Lakewood Gardens Park,,false,
56,38,,,,sapien cum sociis natoque penatibus et magnis dis parturient montes nascetur ridiculus mus etiam vel augue vestibulum rutrum rutrum neque,,,,,43458 Dennis Drive,,false,
57,39,,,,id ligula suspendisse ornare consequat lectus in est risus auctor sed tristique in tempus sit amet sem,,,,,09 Kedzie Junction,,false,
58,40,,,,consectetuer adipiscing elit proin interdum mauris non ligula pellentesque ultrices phasellus id sapien in sapien,,,,,48 Jay Place,,false,
59,41,,,,odio curabitur convallis duis consequat dui nec nisi volutpat eleifend donec ut dolor morbi vel lectus in quam fringilla,,,,,1 South Drive,,false,
60,41,,,,odio curabitur convallis duis consequat dui nec nisi volutpat eleifend donec ut dolor morbi vel lectus in quam fringilla,,,,,6016 Birchwood Avenue,,false,
61,42,,,,ligula vehicula consequat morbi a ipsum integer a nibh in quis justo maecenas rhoncus,,,,,1 Service Court,,false,
62,43,,,,iaculis justo in hac habitasse platea dictumst etiam faucibus cursus urna ut tellus nulla ut erat,,,,,7613 Anthes Circle,,false,
63,44,,,,proin eu mi nulla ac enim in tempor turpis nec,,,,,247 Forest Run Drive,,false,
64,45,,,,ultrices enim lorem ipsum dolor sit amet consectetuer adipiscing elit proin interdum mauris non ligula pellentesque ultrices phasellus id sapien,,,,,39718 Cherokee Alley,,false,
65,45,,,,ultrices enim lorem ipsum dolor sit amet consectetuer adipiscing elit proin interdum mauris non ligula pellentesque ultrices phasellus id sapien,,,,,81 Northport Road,,false,
66,46,,,,nibh fusce lacus purus aliquet at feugiat non pretium quis,,,,,368 Hermina Lane,,false,
67,47,,,,elementum pellentesque quisque porta volutpat erat quisque erat eros viverra eget congue eget semper rutrum nulla nunc,,,,,6330 Vermont Alley,,false,
68,48,,,,sagittis nam congue risus semper porta volutpat quam pede lobortis ligula sit amet eleifend pede libero quis orci nullam,,,,,00482 Kim Lane,,false,
69,49,,,,congue vivamus metus arcu adipiscing molestie hendrerit at vulputate vitae nisl,,,,,0 Pennsylvania Circle,,false,
70,50,,,,et tempus semper est quam pharetra magna ac consequat metus sapien ut nunc vestibulum,,,,,96 6th Parkway,,false,
71,51,,,,integer pede justo lacinia eget tincidunt eget tempus vel pede,,,,,85063 Blaine Avenue,,false,
72,51,,,,integer pede justo lacinia eget tincidunt eget tempus vel pede,,,,,95610 Superior Junction,,false,
73,52,,,,semper porta volutpat quam pede lobortis ligula sit amet eleifend pede libero quis orci nullam molestie nibh,,,,,24 Russell Avenue,,false,
74,53,,,,augue a suscipit nulla elit ac nulla sed vel enim sit amet nunc viverra dapibus nulla suscipit ligula in lacus,,,,,8373 High Crossing Park,,false,
75,54,,,,nunc viverra dapibus nulla suscipit ligula in lacus curabitur at ipsum ac tellus semper interdum mauris ullamcorper,,,,,531 Almo Junction,,false,
76,55,,,,aenean lectus pellentesque eget nunc donec quis orci eget orci,,,,,818 Arizona Alley,,false,
77,56,,,,sagittis nam congue risus semper porta volutpat quam pede lobortis ligula sit amet,,,,,79476 Dexter Hill,,false,
78,56,,,,sagittis nam congue risus semper porta volutpat quam pede lobortis ligula sit amet,,,,,39660 Waukeena Rd,,false,
79,57,,,,velit eu est congue elementum in hac habitasse platea dictumst morbi vestibulum,,,,,62602 Hayes Pass,,false,
80,57,,,,velit eu est congue elementum in hac habitasse platea dictumst morbi vestibulum,,,,,277 Rockefeller Plaza,,false,
81,58,,,,natoque penatibus et magnis dis parturient montes nascetur ridiculus mus vivamus vestibulum sagittis sapien,,,,,02052 Mesta Way,,false,
82,58,,,,natoque penatibus et magnis dis parturient montes nascetur ridiculus mus vivamus vestibulum sagittis sapien,,,,,8048 Di Loreto Junction,,false,
83,59,,,,fusce posuere felis sed lacus morbi sem mauris laoreet ut rhoncus aliquet pulvinar sed nisl nunc rhoncus dui vel,,,,,66 East Junction,,false,
84,60,,,,mi in porttitor pede justo eu massa donec dapibus duis at velit eu est congue elementum in,,,,,5 Manitowish Terrace,,false,
85,61,,,,pulvinar lobortis est phasellus sit amet erat nulla tempus vivamus in felis,,,,,6 Hagan Terrace,,false,
86,62,,,,arcu sed augue aliquam erat volutpat in congue etiam justo etiam pretium iaculis justo in hac,,,,,449 Graedel Pass,,false,
87,63,,,,dictumst maecenas ut massa quis augue luctus tincidunt nulla mollis molestie lorem quisque ut erat curabitur gravida,,,,,61 Heath Way,,false,
88,64,,,,quis orci eget orci vehicula condimentum curabitur in libero ut massa volutpat convallis morbi,,,,,183 Manitowish Avenue,,false,
89,65,,,,eleifend luctus ultricies eu nibh quisque id justo sit amet sapien dignissim vestibulum vestibulum ante ipsum primis in faucibus orci,,,,,76682 Victoria Hill,,false,
90,66,,,,ut nunc vestibulum ante ipsum primis in faucibus orci luctus,,,,,61451 Heath Court,,false,
91,67,,,,velit nec nisi vulputate nonummy maecenas tincidunt lacus at velit vivamus vel nulla eget eros elementum,,,,,2 Paget Avenue,,false,
92,68,,,,quis lectus suspendisse potenti in eleifend quam a odio in hac habitasse platea,,,,,87767 Hazelcrest Trail,,false,
93,68,,,,quis lectus suspendisse potenti in eleifend quam a odio in hac habitasse platea,,,,,71 Milwaukee Pass,,false,
94,68,,,,iaculis justo in hac habitasse platea dictumst etiam faucibus cursus urna ut tellus nulla ut erat,,,,,875 Monument Lane,,false,
95,68,,,,augue a suscipit nulla elit ac nulla sed vel enim sit amet nunc viverra dapibus nulla suscipit ligula in lacus,,,,,Long Beach Office,,false,
96,69,,,,aliquam quis turpis eget elit sodales scelerisque mauris sit amet,,,,,836 Northfield Center,,false,
97,69,,,,aliquam quis turpis eget elit sodales scelerisque mauris sit amet,,,,,70 Bellgrove Center,,false,
98,70,,,,sem praesent id massa id nisl venenatis lacinia aenean sit amet justo morbi ut,,,,,0 Fair Oaks Road,,false,
99,70,,,,sem praesent id massa id nisl venenatis lacinia aenean sit amet justo morbi ut,,,,,6131 Canary Crossing,,false,
100,71,,,,hendrerit at vulputate vitae nisl aenean lectus pellentesque eget nunc donec quis orci eget orci vehicula,,,,,80 2nd Court,,false,
101,72,,,,volutpat sapien arcu sed augue aliquam erat volutpat in congue,,,,,917 Mallard Place,,false,
102,73,,,,odio consequat varius integer ac leo pellentesque ultrices mattis odio donec,,,,,458 Center Pass,,false,
103,74,,,,quam pharetra magna ac consequat metus sapien ut nunc vestibulum ante ipsum primis in,,,,,7 8th Hill,,false,
104,75,,,,magna vestibulum aliquet ultrices erat tortor sollicitudin mi sit amet lobortis sapien sapien non mi integer ac neque duis,,,,,85090 Mitchell Center,,false,
105,76,,,,arcu sed augue aliquam erat volutpat in congue etiam justo etiam pretium iaculis justo in hac habitasse platea,,,,,65363 Anthes Way,,false,
106,77,,,,est risus auctor sed tristique in tempus sit amet sem fusce consequat,,,,,8660 Sherman Junction,,false,
107,78,,,,eget eros elementum pellentesque quisque porta volutpat erat quisque erat eros viverra eget congue eget semper,,,,,869 Jenna Terrace,,false,
108,79,,,,consectetuer adipiscing elit proin risus praesent lectus vestibulum quam sapien,,,,,87320 New Castle Way,,false,
109,80,,,,vel est donec odio justo sollicitudin ut suscipit a feugiat et eros vestibulum ac est lacinia nisi venenatis tristique fusce,,,,,7360 Northwestern Road,,false,
110,80,,,,vel est donec odio justo sollicitudin ut suscipit a feugiat et eros vestibulum ac est lacinia nisi venenatis tristique fusce,,,,,808 Arkansas Alley,,false,
111,80,,,,ultrices enim lorem ipsum dolor sit amet consectetuer adipiscing elit proin interdum mauris non ligula pellentesque ultrices phasellus id sapien,,,,,Sacramento Office 2,,false,
112,81,,,,habitasse platea dictumst maecenas ut massa quis augue luctus tincidunt nulla,,,,,7 Dottie Circle,,false,
113,82,,,,ac consequat metus sapien ut nunc vestibulum ante ipsum primis in faucibus orci luctus et ultrices posuere cubilia curae,,,,,14 Burrows Place,,false,
114,83,,,,in porttitor pede justo eu massa donec dapibus duis at velit eu est congue elementum in hac habitasse,,,,,869 Summit Point,,false,
115,84,,,,suspendisse potenti in eleifend quam a odio in hac habitasse platea dictumst maecenas ut massa quis augue,,,,,4 Del Sol Circle,,false,
116,85,,,,nascetur ridiculus mus etiam vel augue vestibulum rutrum rutrum neque aenean auctor gravida sem praesent id massa id,,,,,9659 Buhler Avenue,,false,
117,86,,,,ridiculus mus etiam vel augue vestibulum rutrum rutrum neque aenean,,,,,56500 Columbus Terrace,,false,
118,87,,,,posuere cubilia curae nulla dapibus dolor vel est donec odio justo sollicitudin ut suscipit,,,,,9978 Lawn Drive,,false,
119,88,,,,commodo vulputate justo in blandit ultrices enim lorem ipsum dolor sit amet,,,,,8929 Rowland Junction,,false,
120,89,,,,in porttitor pede justo eu massa donec dapibus duis at velit eu est congue elementum in hac habitasse,,,,,2215 Blaine Crossing,,false,
121,90,,,,eget tincidunt eget tempus vel pede morbi porttitor lorem id ligula suspendisse ornare consequat lectus in est,,,,,799 Moose Lane,,false,
122,91,,,,auctor gravida sem praesent id massa id nisl venenatis lacinia,,,,,06 Crest Line Plaza,,false,
123,92,,,,sapien iaculis congue vivamus metus arcu adipiscing molestie hendrerit at vulputate vitae nisl aenean lectus pellentesque eget nunc,,,,,365 Transport Way,,false,
124,93,,,,massa donec dapibus duis at velit eu est congue elementum in hac habitasse platea dictumst morbi,,,,,606 Lakewood Gardens Pass,,false,
125,94,,,,orci nullam molestie nibh in lectus pellentesque at nulla suspendisse potenti cras in purus eu magna vulputate luctus cum sociis,,,,,680 Spaight Way,,false,
126,95,,,,nulla nisl nunc nisl duis bibendum felis sed interdum venenatis turpis,,,,,55725 Montana Pass,,false,
127,95,,,,nulla nisl nunc nisl duis bibendum felis sed interdum venenatis turpis,,,,,26806 Charing Cross Alley,,false,
128,96,,,,sit amet sem fusce consequat nulla nisl nunc nisl duis bibendum felis sed interdum venenatis,,,,,8855 Oakridge Hill,,false,
129,97,,,,proin leo odio porttitor id consequat in consequat ut nulla sed accumsan felis ut at dolor quis odio consequat varius,,,,,94011 Westerfield Point,,false,
130,98,,,,vehicula condimentum curabitur in libero ut massa volutpat convallis morbi odio odio elementum eu interdum eu tincidunt in leo,,,,,063 Schlimgen Road,,false,
131,99,,,,nunc vestibulum ante ipsum primis in faucibus orci luctus et ultrices posuere cubilia curae mauris viverra diam vitae quam,,,,,71 Towne Center,,false,
132,100,,,,sapien cursus vestibulum proin eu mi nulla ac enim in tempor turpis nec euismod,,,,,0114 Dakota Circle,,false,
133,101,,,,sollicitudin vitae consectetuer eget rutrum at lorem integer tincidunt ante vel ipsum praesent blandit lacinia erat vestibulum sed,,,,,636 Scott Alley,,false,
134,102,,,,cum sociis natoque penatibus et magnis dis parturient montes nascetur ridiculus mus vivamus vestibulum sagittis sapien cum sociis natoque penatibus,,,,,69 Warner Plaza,,false,
135,103,,,,faucibus orci luctus et ultrices posuere cubilia curae duis faucibus,,,,,4 Sloan Center,,false,
136,104,,,,tellus semper interdum mauris ullamcorper purus sit amet nulla quisque arcu libero rutrum ac lobortis vel,,,,,013 Old Shore Road,,false,
137,105,,,,mus etiam vel augue vestibulum rutrum rutrum neque aenean auctor gravida,,,,,9 Magdeline Road,,false,
138,105,,,,mus etiam vel augue vestibulum rutrum rutrum neque aenean auctor gravida,,,,,Chula Vista Office,,false,
139,106,,,,dolor vel est donec odio justo sollicitudin ut suscipit a feugiat et eros vestibulum ac est,,,,,7 Farwell Avenue,,false,
140,107,,,,porta volutpat quam pede lobortis ligula sit amet eleifend pede libero quis orci nullam molestie,,,,,4 Elmside Way,,false,
141,108,,,,ornare consequat lectus in est risus auctor sed tristique in tempus sit amet sem fusce consequat nulla nisl nunc nisl,,,,,309 Stuart Crossing,,false,
142,109,,,,molestie lorem quisque ut erat curabitur gravida nisi at nibh in hac habitasse platea dictumst aliquam augue quam sollicitudin,,,,,56864 Quincy Terrace,,false,
143,110,,,,aliquam lacus morbi quis tortor id nulla ultrices aliquet maecenas leo odio condimentum id luctus nec molestie sed,,,,,78 Loeprich Lane,,false,
144,111,,,,elementum pellentesque quisque porta volutpat erat quisque erat eros viverra eget congue eget semper rutrum nulla nunc purus phasellus in,,,,,93602 Esch Street,,false,
145,112,,,,tincidunt in leo maecenas pulvinar lobortis est phasellus sit amet,,,,,62501 Spenser Pass,,false,
146,113,,,,est phasellus sit amet erat nulla tempus vivamus in felis eu sapien cursus vestibulum proin eu mi nulla,,,,,68 Esch Place,,false,
147,113,,,,est phasellus sit amet erat nulla tempus vivamus in felis eu sapien cursus vestibulum proin eu mi nulla,,,,,SF Office,,false,
148,114,,,,a pede posuere nonummy integer non velit donec diam neque vestibulum eget vulputate ut ultrices vel augue,,,,,482 Quincy Park,,false,
149,115,,,,tempus sit amet sem fusce consequat nulla nisl nunc nisl duis bibendum,,,,,3423 Hanson Parkway,,false,
150,116,,,,libero quis orci nullam molestie nibh in lectus pellentesque at nulla suspendisse potenti cras in purus eu,,,,,5 Talisman Court,,false,
151,117,,,,auctor gravida sem praesent id massa id nisl venenatis lacinia aenean sit amet justo,,,,,44372 Sutteridge Terrace,,false,
152,118,,,,in consequat ut nulla sed accumsan felis ut at dolor quis odio,,,,,8 Eagan Crossing,,false,
153,119,,,,ac diam cras pellentesque volutpat dui maecenas tristique est et tempus semper est quam pharetra,,,,,66177 Graedel Crossing,,false,
154,120,,,,est quam pharetra magna ac consequat metus sapien ut nunc vestibulum ante ipsum primis in,,,,,9 Scott Plaza,,false,
155,121,,,,ac nibh fusce lacus purus aliquet at feugiat non pretium quis lectus suspendisse potenti in eleifend,,,,,40 Mesta Hill,,false,
156,122,,,,convallis tortor risus dapibus augue vel accumsan tellus nisi eu orci mauris lacinia sapien quis libero nullam,,,,,51 Spohn Avenue,,false,
157,122,,,,convallis tortor risus dapibus augue vel accumsan tellus nisi eu orci mauris lacinia sapien quis libero nullam,,,,,61042 Harbort Way,,false,
158,122,,,,nibh fusce lacus purus aliquet at feugiat non pretium quis,,,,,Old Shore Road Office,,false,
159,123,,,,dapibus duis at velit eu est congue elementum in hac habitasse platea dictumst morbi vestibulum velit id pretium iaculis,,,,,26 Maple Wood Drive,,false,
160,123,,,,nam dui proin leo odio porttitor id consequat in consequat ut nulla sed accumsan,,,,,New Castle Street Location,,false,
161,124,,,,cubilia curae nulla dapibus dolor vel est donec odio justo sollicitudin ut suscipit,,,,,720 Summerview Street,,false,
162,125,,,,sapien quis libero nullam sit amet turpis elementum ligula vehicula,,,,,77 Village Green Plaza,,false,
163,126,,,,aenean sit amet justo morbi ut odio cras mi pede malesuada in,,,,,921 Morning Pass,,false,
164,127,,,,quis odio consequat varius integer ac leo pellentesque ultrices mattis odio donec vitae nisi nam ultrices,,,,,69540 Main Court,,false,
165,128,,,,dui vel sem sed sagittis nam congue risus semper porta volutpat quam,,,,,89359 Becker Hill,,false,
166,129,,,,aliquet massa id lobortis convallis tortor risus dapibus augue vel accumsan,,,,,27826 Cherokee Alley,,false,
167,130,,,,odio justo sollicitudin ut suscipit a feugiat et eros vestibulum ac est lacinia nisi venenatis tristique fusce congue diam id,,,,,265 Fair Oaks Lane,,false,
168,131,,,,sed lacus morbi sem mauris laoreet ut rhoncus aliquet pulvinar sed nisl nunc rhoncus dui vel,,,,,3762 Bluestem Hill,,false,
169,132,,,,nam dui proin leo odio porttitor id consequat in consequat ut nulla sed accumsan,,,,,00 Maple Parkway,,false,
170,133,,,,at lorem integer tincidunt ante vel ipsum praesent blandit lacinia erat vestibulum sed magna at nunc commodo,,,,,420 Bayside Park,,false,
171,133,,,,at lorem integer tincidunt ante vel ipsum praesent blandit lacinia erat vestibulum sed magna at nunc commodo,,,,,Alhambra Office,,false,
172,133,,,,sagittis nam congue risus semper porta volutpat quam pede lobortis ligula sit amet eleifend pede libero quis orci nullam,,,,,01 Susan Avenue,,false,
173,134,,,,dui proin leo odio porttitor id consequat in consequat ut nulla sed accumsan felis ut at dolor quis,,,,,5945 Gulseth Crossing,,false,
174,135,,,,nunc donec quis orci eget orci vehicula condimentum curabitur in libero ut,,,,,8 Comanche Parkway,,false,
175,136,,,,maecenas tristique est et tempus semper est quam pharetra magna ac consequat metus sapien ut,,,,,319 Dexter Terrace,,false,
176,137,,,,aliquet at feugiat non pretium quis lectus suspendisse potenti in eleifend,,,,,52 Sommers Parkway,,false,
177,138,,,,praesent blandit nam nulla integer pede justo lacinia eget tincidunt eget tempus vel pede morbi porttitor lorem id ligula,,,,,6311 Dottie Junction,,false,
178,138,,,,praesent blandit nam nulla integer pede justo lacinia eget tincidunt eget tempus vel pede morbi porttitor lorem id ligula,,,,,908 Valley Edge Place,,false,
179,139,,,,sapien cum sociis natoque penatibus et magnis dis parturient montes nascetur ridiculus mus etiam vel augue vestibulum rutrum rutrum neque,,,,,5587 Algoma Court,,false,
180,140,,,,id ligula suspendisse ornare consequat lectus in est risus auctor sed tristique in tempus sit amet sem,,,,,68209 Fuller Street,,false,
181,141,,,,consectetuer adipiscing elit proin interdum mauris non ligula pellentesque ultrices phasellus id sapien in sapien,,,,,9306 Warrior Park,,false,
182,142,,,,odio curabitur convallis duis consequat dui nec nisi volutpat eleifend donec ut dolor morbi vel lectus in quam fringilla,,,,,9 High Crossing Crossing,,false,
183,143,,,,ligula vehicula consequat morbi a ipsum integer a nibh in quis justo maecenas rhoncus,,,,,75 Lyons Center,,false,
184,143,,,,ligula vehicula consequat morbi a ipsum integer a nibh in quis justo maecenas rhoncus,,,,,09 Basil Lane,,false,
185,144,,,,iaculis justo in hac habitasse platea dictumst etiam faucibus cursus urna ut tellus nulla ut erat,,,,,19 Weeping Birch Street,,false,
186,145,,,,proin eu mi nulla ac enim in tempor turpis nec,,,,,99610 Hansons Crossing,,false,
187,146,,,,ultrices enim lorem ipsum dolor sit amet consectetuer adipiscing elit proin interdum mauris non ligula pellentesque ultrices phasellus id sapien,,,,,12886 Utah Trail,,false,
188,147,,,,nibh fusce lacus purus aliquet at feugiat non pretium quis,,,,,420 Chinook Center,,false,
189,148,,,,elementum pellentesque quisque porta volutpat erat quisque erat eros viverra eget congue eget semper rutrum nulla nunc,,,,,2 School Street,,false,
190,149,,,,sagittis nam congue risus semper porta volutpat quam pede lobortis ligula sit amet eleifend pede libero quis orci nullam,,,,,671 Sutherland Hill,,false,
191,150,,,,congue vivamus metus arcu adipiscing molestie hendrerit at vulputate vitae nisl,,,,,705 Upham Plaza,,false,
192,151,,,,et tempus semper est quam pharetra magna ac consequat metus sapien ut nunc vestibulum,,,,,08646 Truax Point,,false,
193,151,,,,et tempus semper est quam pharetra magna ac consequat metus sapien ut nunc vestibulum,,,,,Wested Lane Location,,false,
194,151,,,,congue vivamus metus arcu adipiscing molestie hendrerit at vulputate vitae nisl,,,,,Dixon Office,,false,
195,152,,,,integer pede justo lacinia eget tincidunt eget tempus vel pede,,,,,20 Upham Pass,,false,
196,153,,,,semper porta volutpat quam pede lobortis ligula sit amet eleifend pede libero quis orci nullam molestie nibh,,,,,687 Village Circle,,false,
197,154,,,,augue a suscipit nulla elit ac nulla sed vel enim sit amet nunc viverra dapibus nulla suscipit ligula in lacus,,,,,4 Red Cloud Pass,,false,
198,155,,,,nunc viverra dapibus nulla suscipit ligula in lacus curabitur at ipsum ac tellus semper interdum mauris ullamcorper,,,,,2370 Cordelia Crossing,,false,
199,156,,,,aenean lectus pellentesque eget nunc donec quis orci eget orci,,,,,70 Melrose Road,,false,
200,157,,,,sagittis nam congue risus semper porta volutpat quam pede lobortis ligula sit amet,,,,,686 Chinook Parkway,,false,
201,158,,,,velit eu est congue elementum in hac habitasse platea dictumst morbi vestibulum,,,,,8 Dovetail Alley,,false,
202,159,,,,natoque penatibus et magnis dis parturient montes nascetur ridiculus mus vivamus vestibulum sagittis sapien,,,,,57614 Wayridge Park,,false,
203,160,,,,fusce posuere felis sed lacus morbi sem mauris laoreet ut rhoncus aliquet pulvinar sed nisl nunc rhoncus dui vel,,,,,33828 Claremont Trail,,false,
204,161,,,,mi in porttitor pede justo eu massa donec dapibus duis at velit eu est congue elementum in,,,,,33 Burning Wood Pass,,false,
205,162,,,,pulvinar lobortis est phasellus sit amet erat nulla tempus vivamus in felis,,,,,71 Havey Hill,,false,
206,163,,,,arcu sed augue aliquam erat volutpat in congue etiam justo etiam pretium iaculis justo in hac,,,,,5245 Scoville Plaza,,false,
207,164,,,,dictumst maecenas ut massa quis augue luctus tincidunt nulla mollis molestie lorem quisque ut erat curabitur gravida,,,,,8296 Lawn Circle,,false,
208,165,,,,quis orci eget orci vehicula condimentum curabitur in libero ut massa volutpat convallis morbi,,,,,96 Little Fleur Trail,,false,
209,166,,,,eleifend luctus ultricies eu nibh quisque id justo sit amet sapien dignissim vestibulum vestibulum ante ipsum primis in faucibus orci,,,,,261 Thompson Drive,,false,
