id,organization_id,accessibility,admin_emails,alternate_name,description,email,languages,latitude,longitude,name,transportation,virtual,website
210,166,,,,eleifend luctus ultricies eu nibh quisque id justo sit amet sapien dignissim vestibulum vestibulum ante ipsum primis in faucibus orci,,,,,43 Shoshone Drive,,false,
211,166,,,,et tempus semper est quam pharetra magna ac consequat metus sapien ut nunc vestibulum,,,,,Oakland Office,,false,
212,166,,,,nunc viverra dapibus nulla suscipit ligula in lacus curabitur at ipsum ac tellus semper interdum mauris ullamcorper,,,,,Dottie Drive,,false,
213,166,,,,arcu sed augue aliquam erat volutpat in congue etiam justo etiam pretium iaculis justo in hac,,,,,364 Harper Drive,,false,
214,167,,,,ut nunc vestibulum ante ipsum primis in faucibus orci luctus,,,,,6459 Mitchell Parkway,,false,
215,167,,,,ut nunc vestibulum ante ipsum primis in faucibus orci luctus,,,,,San Bernardino Office,,false,
216,168,,,,velit nec nisi vulputate nonummy maecenas tincidunt lacus at velit vivamus vel nulla eget eros elementum,,,,,0936 3rd Plaza,,false,
217,169,,,,quis lectus suspendisse potenti in eleifend quam a odio in hac habitasse platea,,,,,9266 Beilfuss Hill,,false,
218,170,,,,aliquam quis turpis eget elit sodales scelerisque mauris sit amet,,,,,50447 Continental Court,,false,
219,171,,,,sem praesent id massa id nisl venenatis lacinia aenean sit amet justo morbi ut,,,,,260 Veith Point,,false,
220,172,,,,hendrerit at vulputate vitae nisl aenean lectus pellentesque eget nunc donec quis orci eget orci vehicula,,,,,22 Bartelt Pass,,false,
221,173,,,,volutpat sapien arcu sed augue aliquam erat volutpat in congue,,,,,82833 Commercial Lane,,false,
222,174,,,,odio consequat varius integer ac leo pellentesque ultrices mattis odio donec,,,,,23 Carey Avenue,,false,
223,174,,,,ut nunc vestibulum ante ipsum primis in faucibus orci luctus,,,,,Sloan Junction Location,,false,
224,175,,,,quam pharetra magna ac consequat metus sapien ut nunc vestibulum ante ipsum primis in,,,,,80859 Harbort Junction,,false,
225,176,,,,magna vestibulum aliquet ultrices erat tortor sollicitudin mi sit amet lobortis sapien sapien non mi integer ac neque duis,,,,,26 Union Crossing,,false,
226,177,,,,arcu sed augue aliquam erat volutpat in congue etiam justo etiam pretium iaculis justo in hac habitasse platea,,,,,5362 Ronald Regan Drive,,false,
227,178,,,,est risus auctor sed tristique in tempus sit amet sem fusce consequat,,,,,84539 Spenser Drive,,false,
228,179,,,,eget eros elementum pellentesque quisque porta volutpat erat quisque erat eros viverra eget congue eget semper,,,,,48 North Road,,false,
229,180,,,,consectetuer adipiscing elit proin risus praesent lectus vestibulum quam sapien,,,,,42487 Haas Place,,false,
230,180,,,,ut nunc vestibulum ante ipsum primis in faucibus orci luctus,,,,,LA Office,,false,
231,180,,,,semper porta volutpat quam pede lobortis ligula sit amet eleifend pede libero quis orci nullam molestie nibh,,,,,9793 Fairview Pass,,false,
232,181,,,,vel est donec odio justo sollicitudin ut suscipit a feugiat et eros vestibulum ac est lacinia nisi venenatis tristique fusce,,,,,558 Mccormick Hill,,false,
233,182,,,,habitasse platea dictumst maecenas ut massa quis augue luctus tincidunt nulla,,,,,491 Brown Avenue,,false,
234,183,,,,ac consequat metus sapien ut nunc vestibulum ante ipsum primis in faucibus orci luctus et ultrices posuere cubilia curae,,,,,887 Schmedeman Crossing,,false,
235,184,,,,in porttitor pede justo eu massa donec dapibus duis at velit eu est congue elementum in hac habitasse,,,,,51669 Canary Trail,,false,
236,185,,,,suspendisse potenti in eleifend quam a odio in hac habitasse platea dictumst maecenas ut massa quis augue,,,,,92898 Anzinger Drive,,false,
237,185,,,,suspendisse potenti in eleifend quam a odio in hac habitasse platea dictumst maecenas ut massa quis augue,,,,,0 Thackeray Drive,,false,
