id,location_id,program_id,accepted_payments,alternate_name,description,eligibility,email,fees,funding_sources,application_process,interpretation_sources,keywords,languages,name,required_documents,service_areas,status,wait_time,website,taxonomy_ids
1,1,,,,"The Greater Sacramento Urban League has a Career Center where individuals can receive career service(s) Basic Services : Intake, work readiness instruction , assessments, counseling Individualized Service(s) Development of an individual employment plan, in-depth interviewing and evaluation to identify employment barriers and appropriate employment goals.",,,Free,,,,,,"Education, Job Training, & Placement Opportunities",,,active,,http://www.gsul.org,"101-12,101-12-03,101-05,101-05-01,102-01,102-02,102-03,103-01,103-02,103-03,103-04,105-01,105-02,105-03,105-04,105-05,105-06,105-08,105-09,105-10,105-11,105-12,105-13,105-14,105-16,105-17,105-18,105-19,105-20,105-21,105-22"
2,3,,,,"Vestibulum sed magna at nunc commodo placerat. Praesent blandit. Nam nulla. Integer pede justo, lacinia eget, tincidunt eget, tempus vel, pede. Morbi porttitor lorem id ligula.",,,Free,,,,,,"Small business counseling and training, financial assistance, and government contracting assistance.",,,active,,https://SBA.gov,"101-02,101-02-04,101-02-06,101-02-07,101-07,101-07-01,101-12,102-01,102-02,102-03,103-01,103-02,103-03,103-04,105-01,105-02,105-03,105-04,105-05,105-06,105-08,105-09,105-10,105-11,105-12,105-14,105-16,105-17,105-18,105-19,105-20,105-21,105-22"
3,6,,,,Shared open office space with conference rooms and phone booths for startups.,,,Fee Charged,,,,,,Shared Office Space,,,active,,http://chicostart.com,"101-11,101-11-03,101-11-04,101-11-05,101-11-07,102-01,103-01,103-02,103-03,103-04,105-01,105-03,105-09,105-10,105-16"
4,6,,,,"We provide mentoring, resources and networking to our startups to help them succeed.",,,Fee Charged,,,,,,Incubator and resources to startups,,,active,,http://chicostart.com,"101-11,101-11-03,101-11-04,101-11-05,101-11-07,102-01,103-01,103-02,103-03,103-04,105-01,105-03,105-09,105-10,105-16"
5,7,,,,"We provide promotion opportunities for businesses located in, or wanting to do business in the Arden-Arcade community, include online promotions via email lists and social media, monthly networking mixers, and other promotional opportunities in the community.",,,Free,,,,,,Community Networking,,,active,,https://www.greaterarden.com,"101-05,101-05-02,101-05-04,101-05-05,102-01,102-02,102-03,103-01,105-01,105-02,105-03,105-04,105-05,105-06,105-08,105-09,105-10,105-11,105-12,105-13,105-14,105-16,105-17,105-18,105-19,105-20,105-21,105-22"
6,8,,,,Sed ante. Vivamus tortor. Duis mattis egestas metus. Aenean fermentum. Donec ut mauris eget massa tempor convallis.,,,Free,,,,,,Lutra canadensis,,,active,,https://mail.ru/accumsan/odio/curabitur/convallis.aspx,"101-03,101-04,101-05,101-06,102-01,102-02,102-03,103-01"
7,9,,,,"Vestibulum sed magna at nunc commodo placerat. Praesent blandit. Nam nulla. Integer pede justo, lacinia eget, tincidunt eget, tempus vel, pede. Morbi porttitor lorem id ligula.",,,Fee Charged,,,,,,Francolinus swainsonii,,,active,,https://reddit.com/sit.aspx,"101-03,101-04,101-05,101-06,102-01,102-02,102-03,103-01"
8,11,,,,Aenean fermentum. Donec ut mauris eget massa tempor convallis.,,,Free,,,,,,Dasyprocta leporina,,,active,,http://fotki.com/nisl/nunc/nisl/duis/bibendum/felis.jsp,"101-03,101-03-04,101-04,101-05,101-06,102-01,102-02,102-03,103-01,104-09"
9,12,,,,"Mauris enim leo, rhoncus sed, vestibulum sit amet, cursus id, turpis. Integer aliquet, massa id lobortis convallis, tortor risus dapibus augue, vel accumsan tellus nisi eu orci. Mauris lacinia sapien quis libero. Nullam sit amet turpis elementum ligula vehicula consequat. Morbi a ipsum.",,,Fee Charged,,,,,,Ovibos moschatus,,,active,,https://aboutads.info/phasellus/id.jsp,"101-13,102-01,103-01"
10,13,,,,Vestibulum ante ipsum primis in faucibus orci luctus et ultrices posuere cubilia Curae; Mauris viverra diam vitae quam. Suspendisse potenti.,,,Free,,,,,,Phalaropus fulicarius,,,active,,https://nasa.gov/volutpat/erat/quisque.json,"101-04,101-08,102-01,102-02,102-03,103-01"
11,14,,,,"Aenean auctor gravida sem. Praesent id massa id nisl venenatis lacinia. Aenean sit amet justo. Morbi ut odio. Cras mi pede, malesuada in, imperdiet et, commodo vulputate, justo. In blandit ultrices enim.",,,Free,,,,,,Dasypus novemcinctus,,,active,,http://sakura.ne.jp/fusce.jsp,"101-03,101-04,101-05,101-06,102-01,102-02,102-03,103-01"
12,15,,,,"Nulla ac enim. In tempor, turpis nec euismod scelerisque, quam turpis adipiscing lorem, vitae mattis nibh ligula nec sem. Duis aliquam convallis nunc. Proin at turpis a pede posuere nonummy. Integer non velit.",,,Free,,,,,,Pycnonotus barbatus,,,active,,https://chicagotribune.com/vestibulum/aliquet/ultrices.html,"101-02,101-03,101-11,101-12,101-13,102-01,102-02,102-03,103-01"
13,17,,,,Nulla tellus.,,,Fee Charged,,,,,,Francolinus coqui,,,active,,http://reference.com/ut.html,"101-03,101-04,101-07,101-07-02,102-01,103-01"
14,17,,,,"In hac habitasse platea dictumst. Morbi vestibulum, velit id pretium iaculis, diam erat fermentum justo, nec condimentum neque sapien placerat ante.",,,Free,,,,,,Tachybaptus ruficollis,,,active,,https://whitehouse.gov/ultrices/posuere/cubilia/curae/donec.aspx,"101-03,101-04,101-07,101-07-02,102-01,103-01"
15,17,,,,"Nam ultrices, libero non mattis pulvinar, nulla pede ullamcorper augue, a suscipit nulla elit ac nulla. Sed vel enim sit amet nunc viverra dapibus. Nulla suscipit ligula in lacus.",,,Free,,,,,,Taurotagus oryx,,,active,,http://cocolog-nifty.com/vestibulum.html,"101-03,101-04,101-07,101-07-02,102-01,103-01"
16,18,,,,"Aliquam augue quam, sollicitudin vitae, consectetuer eget, rutrum at, lorem. Integer tincidunt ante vel ipsum. Praesent blandit lacinia erat. Vestibulum sed magna at nunc commodo placerat. Praesent blandit. Nam nulla. Integer pede justo, lacinia eget, tincidunt eget, tempus vel, pede.",,,Free,,,,,,Otaria flavescens,,,active,,http://google.it/nunc/proin/at/turpis/a.xml,"101-04,102-01,102-02,102-03,103-02"
17,19,,,,"Phasellus in felis. Donec semper sapien a libero. Nam dui. Proin leo odio, porttitor id, consequat in, consequat ut, nulla. Sed accumsan felis.",,,Free,,,,,,Tiliqua scincoides,,,active,,http://google.com.au/in/magna.xml,"101-13,102-01,102-02,102-03,103-02"
18,20,,,,Maecenas pulvinar lobortis est. Phasellus sit amet erat. Nulla tempus. Vivamus in felis eu sapien cursus vestibulum.,,,Free,,,,,,Choriotis kori,,,active,,http://businessweek.com/nunc/purus/phasellus/in.xml,"101-09,102-01,102-02,102-03,103-02"
19,22,,,,"Vivamus metus arcu, adipiscing molestie, hendrerit at, vulputate vitae, nisl. Aenean lectus. Pellentesque eget nunc. Donec quis orci eget orci vehicula condimentum. Curabitur in libero ut massa volutpat convallis. Morbi odio odio, elementum eu, interdum eu, tincidunt in, leo.",,,Fee Charged,,,,,,Gyps bengalensis,,,active,,https://github.com/scelerisque/mauris/sit/amet/eros/suspendisse.json,"101-03,101-04,101-05,101-12,101-12-03,102-01,103-02"
20,23,,,,Vestibulum ante ipsum primis in faucibus orci luctus et ultrices posuere cubilia Curae; Mauris viverra diam vitae quam. Suspendisse potenti. Nullam porttitor lacus at turpis. Donec posuere metus vitae ipsum. Aliquam non mauris.,,,Free,,,,,,Sula nebouxii,,,active,,https://joomla.org/et/eros/vestibulum/ac.jsp,"101-02,101-03,101-03-01,101-11,101-11-09,101-12,101-13,102-01,102-02,102-03,103-02,104-05"
21,24,,,,"Fusce posuere felis sed lacus. Morbi sem mauris, laoreet ut, rhoncus aliquet, pulvinar sed, nisl. Nunc rhoncus dui vel sem.",,,Free,,,,,,Eudyptula minor,,,active,,http://squidoo.com/ut/blandit.jsp,"101-03,101-04,101-07,101-07-01,102-01,102-02,102-03,103-02"
22,25,,,,"Morbi non lectus. Aliquam sit amet diam in magna bibendum imperdiet. Nullam orci pede, venenatis non, sodales sed, tincidunt eu, felis. Fusce posuere felis sed lacus. Morbi sem mauris, laoreet ut, rhoncus aliquet, pulvinar sed, nisl.",,,Free,,,,,,Axis axis,,,active,,https://usatoday.com/elit/sodales.js,"101-03,101-04,101-05,101-12,102-01,102-02,102-03,103-01,103-02"
23,25,,,,"Sed vel enim sit amet nunc viverra dapibus. Nulla suscipit ligula in lacus. Curabitur at ipsum ac tellus semper interdum. Mauris ullamcorper purus sit amet nulla. Quisque arcu libero, rutrum ac, lobortis vel, dapibus at, diam.",,,Free,,,,,,Eremophila alpestris,,,active,,https://google.cn/quis/odio/consequat/varius/integer/ac/leo.png,"101-03,101-04,101-05,101-12,102-01,102-02,102-03,103-01,103-02"
24,26,,,,In eleifend quam a odio. In hac habitasse platea dictumst. Maecenas ut massa quis augue luctus tincidunt.,,,Fee Charged,,,,,,Nucifraga columbiana,,,active,,https://baidu.com/curae/duis/faucibus/accumsan/odio/curabitur/convallis.jsp,"101-03,101-04,101-05,101-06,102-01,103-01,103-02"
25,26,,,,"Vestibulum ante ipsum primis in faucibus orci luctus et ultrices posuere cubilia Curae; Donec pharetra, magna vestibulum aliquet ultrices, erat tortor sollicitudin mi, sit amet lobortis sapien sapien non mi. Integer ac neque. Duis bibendum. Morbi non quam nec dui luctus rutrum. Nulla tellus. In sagittis dui vel nisl. Duis ac nibh.",,,Free,,,,,,Felis wiedi or Leopardus weidi,,,active,,https://miitbeian.gov.cn/sodales/sed/tincidunt/eu/felis/fusce.js,"101-03,101-04,101-05,101-06,102-01,103-01,103-02"
26,27,,,,"Donec vitae nisi. Nam ultrices, libero non mattis pulvinar, nulla pede ullamcorper augue, a suscipit nulla elit ac nulla.",,,Free,,,,,,Neotoma sp.,,,active,,https://oaic.gov.au/id/lobortis.js,"101-04,101-08,102-01,102-02,102-03,103-01,103-02"
27,29,,,,"Ut at dolor quis odio consequat varius. Integer ac leo. Pellentesque ultrices mattis odio. Donec vitae nisi. Nam ultrices, libero non mattis pulvinar, nulla pede ullamcorper augue, a suscipit nulla elit ac nulla.",,,Free,,,,,,Francolinus leucoscepus,,,active,,http://arizona.edu/a/libero/nam/dui/proin/leo.jpg,"101-09,101-10,102-01,102-02,102-03,103-01,103-02"
28,30,,,,"Curabitur gravida nisi at nibh. In hac habitasse platea dictumst. Aliquam augue quam, sollicitudin vitae, consectetuer eget, rutrum at, lorem. Integer tincidunt ante vel ipsum. Praesent blandit lacinia erat. Vestibulum sed magna at nunc commodo placerat. Praesent blandit.",,,Free,,,,,,Libellula quadrimaculata,,,active,,https://washington.edu/potenti.js,"102-01,102-02,102-03,103-01,103-02,104-04"
29,30,,,,Pellentesque eget nunc. Donec quis orci eget orci vehicula condimentum. Curabitur in libero ut massa volutpat convallis.,,,Free,,,,,,Corvus brachyrhynchos,,,active,,https://opensource.org/porttitor/lacus/at/turpis.jsp,"102-01,102-02,102-03,103-01,103-02,104-04"
30,30,,,,"Nulla tellus. In sagittis dui vel nisl. Duis ac nibh. Fusce lacus purus, aliquet at, feugiat non, pretium quis, lectus. Suspendisse potenti.",,,Free,,,,,,Bettongia penicillata,,,active,,http://patch.com/cubilia/curae/nulla/dapibus/dolor.xml,"102-01,102-02,102-03,103-01,103-02,104-04"
31,31,,,,"Sed ante. Vivamus tortor. Duis mattis egestas metus. Aenean fermentum. Donec ut mauris eget massa tempor convallis. Nulla neque libero, convallis eget, eleifend luctus, ultricies eu, nibh. Quisque id justo sit amet sapien dignissim vestibulum.",,,Fee Charged,,,,,,Axis axis,,,active,,https://about.com/a/suscipit/nulla/elit/ac/nulla.aspx,"101-02,101-02-09,101-13,102-01,103-01,103-02"
32,32,,,,Etiam justo. Etiam pretium iaculis justo.,,,Free,,,,,,Myiarchus tuberculifer,,,active,,https://facebook.com/rutrum.jsp,"101-03,101-04,101-05,101-06,102-01,102-02,102-03,103-01,103-02"
33,33,,,,"Cras in purus eu magna vulputate luctus. Cum sociis natoque penatibus et magnis dis parturient montes, nascetur ridiculus mus. Vivamus vestibulum sagittis sapien. Cum sociis natoque penatibus et magnis dis parturient montes, nascetur ridiculus mus. Etiam vel augue. Vestibulum rutrum rutrum neque. Aenean auctor gravida sem.",,,Free,,,,,,Boa caninus,,,active,,https://sciencedaily.com/nulla/mollis/molestie/lorem/quisque/ut.html,"101-02,101-11,101-12,101-13,102-01,102-02,102-03,103-01,103-02"
34,35,,,,"Vestibulum rutrum rutrum neque. Aenean auctor gravida sem. Praesent id massa id nisl venenatis lacinia. Aenean sit amet justo. Morbi ut odio. Cras mi pede, malesuada in, imperdiet et, commodo vulputate, justo.",,,Free,,,,,,Delphinus delphis,,,active,,http://ted.com/posuere/felis/sed/lacus/morbi/sem/mauris.json,"101-03,101-04,101-05,101-05-05,101-12,101-12-01,102-01,102-02,102-03,103-01,103-02"
35,37,,,,"Sed sagittis. Nam congue, risus semper porta volutpat, quam pede lobortis ligula, sit amet eleifend pede libero quis orci. Nullam molestie nibh in lectus. Pellentesque at nulla. Suspendisse potenti. Cras in purus eu magna vulputate luctus. Cum sociis natoque penatibus et magnis dis parturient montes, nascetur ridiculus mus.",,,Fee Charged,,,,,,Pteronura brasiliensis,,,active,,https://bbc.co.uk/imperdiet/et/commodo/vulputate.xml,"101-03,101-04,101-05,101-05-02,101-12,102-01,103-01,103-02"
36,39,,,,Nulla ut erat id mauris vulputate elementum. Nullam varius. Nulla facilisi. Cras non velit nec nisi vulputate nonummy. Maecenas tincidunt lacus at velit. Vivamus vel nulla eget eros elementum pellentesque.,,,Free,,,,,,Spermophilus lateralis,,,active,,http://zimbio.com/vel/sem/sed/sagittis/nam.html,"102-01,102-02,102-03,103-01,103-02"
37,40,,,,Mauris lacinia sapien quis libero. Nullam sit amet turpis elementum ligula vehicula consequat. Morbi a ipsum. Integer a nibh. In quis justo. Maecenas rhoncus aliquam lacus. Morbi quis tortor id nulla ultrices aliquet.,,,Free,,,,,,Cebus apella,,,active,,http://chron.com/non/pretium/quis/lectus/suspendisse/potenti.html,"101-13,102-01,102-02,102-03,103-01,103-02"
38,40,,,,"Aliquam non mauris. Morbi non lectus. Aliquam sit amet diam in magna bibendum imperdiet. Nullam orci pede, venenatis non, sodales sed, tincidunt eu, felis. Fusce posuere felis sed lacus. Morbi sem mauris, laoreet ut, rhoncus aliquet, pulvinar sed, nisl.",,,Fee Charged,,,,,,Galictis vittata,,,active,,http://nbcnews.com/habitasse/platea/dictumst.png,"101-13,102-01,102-02,102-03,103-01,103-02"
39,41,,,,"Ut at dolor quis odio consequat varius. Integer ac leo. Pellentesque ultrices mattis odio. Donec vitae nisi. Nam ultrices, libero non mattis pulvinar, nulla pede ullamcorper augue, a suscipit nulla elit ac nulla. Sed vel enim sit amet nunc viverra dapibus.",,,Free,,,,,,Eumetopias jubatus,,,active,,http://bloomberg.com/nulla.html,"101-09,101-10,102-01,102-02,102-03,103-01,103-02,103-03,103-04"
40,42,,,,"Aliquam non mauris. Morbi non lectus. Aliquam sit amet diam in magna bibendum imperdiet. Nullam orci pede, venenatis non, sodales sed, tincidunt eu, felis.",,,Fee Charged,,,,,,Ciconia episcopus,,,active,,http://artisteer.com/porttitor/pede.png,"101-09,102-01,103-01,103-02,103-03,103-04"
41,43,,,,"Donec ut dolor. Morbi vel lectus in quam fringilla rhoncus. Mauris enim leo, rhoncus sed, vestibulum sit amet, cursus id, turpis. Integer aliquet, massa id lobortis convallis, tortor risus dapibus augue, vel accumsan tellus nisi eu orci.",,,Free,,,,,,Francolinus coqui,,,active,,http://tumblr.com/justo/maecenas/rhoncus/aliquam.aspx,"101-04,101-08,102-01,102-02,102-03,103-01,103-02,103-03,103-04"
42,44,,,,Nulla ut erat id mauris vulputate elementum. Nullam varius.,,,Free,,,,,,Crotalus cerastes,,,active,,http://soup.io/amet.png,"101-02,101-03,101-11,101-12,101-13,102-01,102-02,102-03,103-01,103-02,103-03,103-04"
43,45,,,,Maecenas ut massa quis augue luctus tincidunt.,,,Free,,,,,,Bassariscus astutus,,,active,,http://bloglovin.com/montes/nascetur/ridiculus/mus/etiam.png,"102-01,102-02,102-03,103-01,103-02,103-03,103-04"
44,46,,,,Mauris lacinia sapien quis libero. Nullam sit amet turpis elementum ligula vehicula consequat. Morbi a ipsum. Integer a nibh. In quis justo.,,,Fee Charged,,,,,,Alcelaphus buselaphus caama,,,active,,http://deliciousdays.com/ut/rhoncus/aliquet/pulvinar/sed/nisl/nunc.html,"101-03,101-04,101-05,101-12,101-13,102-01,103-01,103-02,103-03,103-04"
45,47,,,,In congue. Etiam justo. Etiam pretium iaculis justo. In hac habitasse platea dictumst.,,,Free,,,,,,Lamprotornis sp.,,,active,,http://reddit.com/posuere/cubilia.aspx,"101-13,102-01,102-02,102-03,103-01,103-02,103-03,103-04"
46,47,,,,"Aenean sit amet justo. Morbi ut odio. Cras mi pede, malesuada in, imperdiet et, commodo vulputate, justo. In blandit ultrices enim.",,,Free,,,,,,Tringa glareola,,,active,,http://alibaba.com/ultrices.xml,"101-13,102-01,102-02,102-03,103-01,103-02,103-03,103-04"
47,48,,,,In sagittis dui vel nisl. Duis ac nibh.,,,Free,,,,,,Sylvicapra grimma,,,active,,https://example.com/ut/erat/curabitur/gravida/nisi.png,"101-09,102-01,102-02,102-03,103-01,103-02,103-03,103-04"
48,52,,,,Nullam molestie nibh in lectus. Pellentesque at nulla. Suspendisse potenti. Cras in purus eu magna vulputate luctus.,,,Free,,,,,,Cygnus buccinator,,,active,,https://shutterfly.com/donec.png,"101-02,101-03,101-04,101-12,101-13,102-01,102-02,102-03,103-01,103-02,103-03,103-04,104-03"
49,54,,,,"Proin risus. Praesent lectus. Vestibulum quam sapien, varius ut, blandit non, interdum in, ante. Vestibulum ante ipsum primis in faucibus orci luctus et ultrices posuere cubilia Curae; Duis faucibus accumsan odio. Curabitur convallis.",,,Fee Charged,,,,,,Bucorvus leadbeateri,,,active,,https://naver.com/dignissim.jpg,"101-09,101-10,102-01,103-03"
50,56,,,,Nunc purus. Phasellus in felis.,,,Free,,,,,,Vulpes cinereoargenteus,,,active,,http://miitbeian.gov.cn/aliquam.json,"101-02,101-11,101-12,101-12-03,101-13,102-01,102-02,102-03,103-03"
51,57,,,,"Fusce congue, diam id ornare imperdiet, sapien urna pretium nisl, ut volutpat sapien arcu sed augue. Aliquam erat volutpat. In congue. Etiam justo. Etiam pretium iaculis justo. In hac habitasse platea dictumst. Etiam faucibus cursus urna.",,,Free,,,,,,Lycosa godeffroyi,,,active,,http://miibeian.gov.cn/non/lectus.json,"101-03,101-04,101-05,101-05-02,101-12,101-12-03,101-13,102-01,102-02,102-03,103-03"
52,58,,,,"Lorem ipsum dolor sit amet, consectetuer adipiscing elit. Proin risus. Praesent lectus. Vestibulum quam sapien, varius ut, blandit non, interdum in, ante.",,,Free,,,,,,Nasua narica,,,active,,http://marriott.com/tincidunt/lacus/at.xml,"101-09,101-10,102-01,102-02,102-03,103-03"
53,59,,,,Maecenas pulvinar lobortis est. Phasellus sit amet erat. Nulla tempus. Vivamus in felis eu sapien cursus vestibulum.,,,Fee Charged,,,,,,Eumetopias jubatus,,,active,,https://123-reg.co.uk/natoque/penatibus/et/magnis/dis.html,"101-02,101-11,101-12,101-12-01,101-13,102-01,103-03"
54,59,,,,Etiam faucibus cursus urna. Ut tellus. Nulla ut erat id mauris vulputate elementum. Nullam varius. Nulla facilisi.,,,Free,,,,,,Macaca mulatta,,,active,,https://yale.edu/tincidunt/in.html,"101-02,101-11,101-12,101-12-01,101-13,102-01,103-03"
55,60,,,,"Phasellus in felis. Donec semper sapien a libero. Nam dui. Proin leo odio, porttitor id, consequat in, consequat ut, nulla. Sed accumsan felis. Ut at dolor quis odio consequat varius.",,,Free,,,,,,Rhabdomys pumilio,,,active,,http://vkontakte.ru/bibendum.aspx,"101-02,101-12,101-12-01,101-13,102-01,102-02,102-03,103-03"
56,61,,,,"Nam ultrices, libero non mattis pulvinar, nulla pede ullamcorper augue, a suscipit nulla elit ac nulla. Sed vel enim sit amet nunc viverra dapibus. Nulla suscipit ligula in lacus. Curabitur at ipsum ac tellus semper interdum. Mauris ullamcorper purus sit amet nulla. Quisque arcu libero, rutrum ac, lobortis vel, dapibus at, diam. Nam tristique tortor eu pede.",,,Free,,,,,,Axis axis,,,active,,http://a8.net/turpis/elementum/ligula/vehicula/consequat/morbi.aspx,"101-02,101-02-03,101-03,101-04,101-12,101-12-01,101-13,102-01,102-02,102-03,103-03"
57,62,,,,Etiam justo. Etiam pretium iaculis justo. In hac habitasse platea dictumst. Etiam faucibus cursus urna. Ut tellus. Nulla ut erat id mauris vulputate elementum. Nullam varius.,,,Free,,,,,,Pteronura brasiliensis,,,active,,https://arizona.edu/sodales/sed/tincidunt/eu/felis/fusce.js,"101-02,101-12,101-12-03,101-13,102-01,102-02,102-03,103-03"
58,63,,,,"Vestibulum ante ipsum primis in faucibus orci luctus et ultrices posuere cubilia Curae; Duis faucibus accumsan odio. Curabitur convallis. Duis consequat dui nec nisi volutpat eleifend. Donec ut dolor. Morbi vel lectus in quam fringilla rhoncus. Mauris enim leo, rhoncus sed, vestibulum sit amet, cursus id, turpis. Integer aliquet, massa id lobortis convallis, tortor risus dapibus augue, vel accumsan tellus nisi eu orci.",,,Fee Charged,,,,,,Calyptorhynchus magnificus,,,active,,https://cornell.edu/vestibulum/rutrum/rutrum/neque/aenean/auctor.png,"101-02,101-03,101-04,101-11,101-12,101-13,102-01,103-03,103-04"
59,64,,,,Praesent blandit lacinia erat. Vestibulum sed magna at nunc commodo placerat.,,,Free,,,,,,Podargus strigoides,,,active,,https://blogtalkradio.com/diam/neque/vestibulum/eget/vulputate.jpg,"101-13,102-01,102-02,102-03,103-03,103-04"
60,65,,,,Phasellus in felis.,,,Free,,,,,,Oxybelis sp.,,,active,,https://yahoo.com/tortor.xml,"101-03,101-04,101-05,101-05-03,102-01,102-02,102-03,103-03,103-04"
61,68,,,,"Maecenas leo odio, condimentum id, luctus nec, molestie sed, justo. Pellentesque viverra pede ac diam. Cras pellentesque volutpat dui. Maecenas tristique, est et tempus semper, est quam pharetra magna, ac consequat metus sapien ut nunc.",,,Free,,,,,,Ovis dalli stonei,,,active,,http://networkadvertising.org/quisque/ut/erat/curabitur/gravida/nisi/at.json,"101-03,101-04,101-07,102-01,102-02,102-03,103-03,103-04"
62,69,,,,"Vestibulum sed magna at nunc commodo placerat. Praesent blandit. Nam nulla. Integer pede justo, lacinia eget, tincidunt eget, tempus vel, pede. Morbi porttitor lorem id ligula. Suspendisse ornare consequat lectus. In est risus, auctor sed, tristique in, tempus sit amet, sem.",,,Fee Charged,,,,,,Buteo galapagoensis,,,active,,https://1688.com/mattis/egestas/metus/aenean/fermentum/donec.xml,"101-13,102-01,103-03,103-04"
63,70,,,,Donec dapibus. Duis at velit eu est congue elementum. In hac habitasse platea dictumst.,,,Free,,,,,,Cacatua tenuirostris,,,active,,https://bandcamp.com/orci/eget/orci/vehicula/condimentum.js,"101-03,101-04,101-05,101-05-04,101-06,102-01,102-02,102-03,103-03,103-04"
64,71,,,,"Fusce consequat. Nulla nisl. Nunc nisl. Duis bibendum, felis sed interdum venenatis, turpis enim blandit mi, in porttitor pede justo eu massa.",,,Free,,,,,,Chionis alba,,,active,,https://rakuten.co.jp/faucibus/orci/luctus/et/ultrices/posuere.json,"101-02,101-03,101-11,101-12,101-12-01,101-13,102-01,102-02,102-03,103-03,103-04"
65,72,,,,"Aenean fermentum. Donec ut mauris eget massa tempor convallis. Nulla neque libero, convallis eget, eleifend luctus, ultricies eu, nibh. Quisque id justo sit amet sapien dignissim vestibulum. Vestibulum ante ipsum primis in faucibus orci luctus et ultrices posuere cubilia Curae; Nulla dapibus dolor vel est. Donec odio justo, sollicitudin ut, suscipit a, feugiat et, eros.",,,Free,,,,,,Nucifraga columbiana,,,active,,https://nps.gov/lobortis/ligula/sit/amet/eleifend.jpg,"101-09,102-01,102-02,102-03,103-03,103-04"
66,72,,,,"Integer aliquet, massa id lobortis convallis, tortor risus dapibus augue, vel accumsan tellus nisi eu orci. Mauris lacinia sapien quis libero. Nullam sit amet turpis elementum ligula vehicula consequat. Morbi a ipsum. Integer a nibh. In quis justo.",,,Free,,,,,,Aegypius occipitalis,,,active,,http://youtu.be/sed/justo/pellentesque.xml,"101-09,102-01,102-02,102-03,103-03,103-04"
67,73,,,,"Donec quis orci eget orci vehicula condimentum. Curabitur in libero ut massa volutpat convallis. Morbi odio odio, elementum eu, interdum eu, tincidunt in, leo. Maecenas pulvinar lobortis est. Phasellus sit amet erat. Nulla tempus. Vivamus in felis eu sapien cursus vestibulum.",,,Free,,,,,,Buteo jamaicensis,,,active,,http://ebay.co.uk/id.aspx,"101-03,101-04,101-05,101-06,102-01,102-02,102-03,103-03,103-04"
68,73,,,,Vestibulum ante ipsum primis in faucibus orci luctus et ultrices posuere cubilia Curae; Mauris viverra diam vitae quam. Suspendisse potenti.,,,Fee Charged,,,,,,Speothos vanaticus,,,active,,https://amazon.co.jp/odio/justo/sollicitudin.xml,"101-03,101-04,101-05,101-06,102-01,102-02,102-03,103-03,103-04"
69,74,,,,"Morbi quis tortor id nulla ultrices aliquet. Maecenas leo odio, condimentum id, luctus nec, molestie sed, justo. Pellentesque viverra pede ac diam. Cras pellentesque volutpat dui. Maecenas tristique, est et tempus semper, est quam pharetra magna, ac consequat metus sapien ut nunc. Vestibulum ante ipsum primis in faucibus orci luctus et ultrices posuere cubilia Curae; Mauris viverra diam vitae quam. Suspendisse potenti.",,,Fee Charged,,,,,,Bugeranus caruncalatus,,,active,,http://merriam-webster.com/in/congue.jpg,"101-02,101-02-03,101-03,101-11,101-12,101-13,102-01,102-02,102-03,103-03,103-04"
70,75,,,,"Duis aliquam convallis nunc. Proin at turpis a pede posuere nonummy. Integer non velit. Donec diam neque, vestibulum eget, vulputate ut, ultrices vel, augue. Vestibulum ante ipsum primis in faucibus orci luctus et ultrices posuere cubilia Curae; Donec pharetra, magna vestibulum aliquet ultrices, erat tortor sollicitudin mi, sit amet lobortis sapien sapien non mi.",,,Free,,,,,,Vulpes vulpes,,,active,,https://bravesites.com/ac/consequat/metus/sapien.json,"101-03,101-04,101-07,101-07-02,102-01,102-02,102-03,103-03,103-04,104-06"
71,76,,,,"Morbi vestibulum, velit id pretium iaculis, diam erat fermentum justo, nec condimentum neque sapien placerat ante. Nulla justo. Aliquam quis turpis eget elit sodales scelerisque. Mauris sit amet eros. Suspendisse accumsan tortor quis turpis. Sed ante.",,,Free,,,,,,Eubalaena australis,,,active,,http://gov.uk/vel/sem.html,"101-03,101-04,101-07,102-01,102-02,102-03,103-03,103-04"
72,77,,,,"Proin leo odio, porttitor id, consequat in, consequat ut, nulla. Sed accumsan felis. Ut at dolor quis odio consequat varius. Integer ac leo. Pellentesque ultrices mattis odio.",,,Free,,,,,,Pelecans onocratalus,,,active,,http://sciencedaily.com/vestibulum/sagittis.js,"101-04,101-08,102-01,102-02,102-03,103-03,103-04"
