id,location_id,program_id,accepted_payments,alternate_name,description,eligibility,email,fees,funding_sources,application_process,interpretation_sources,keywords,languages,name,required_documents,service_areas,status,wait_time,website,taxonomy_ids
149,135,,,,Nullam porttitor lacus at turpis.,,,Fee Charged,,,,,,Mungos mungo,,,active,,https://deviantart.com/viverra/dapibus/nulla/suscipit/ligula/in.json,"101-03,101-04,101-12,101-12-03,101-13,102-01,102-02,102-03,103-01"
150,136,,,,"Duis ac nibh. Fusce lacus purus, aliquet at, feugiat non, pretium quis, lectus. Suspendisse potenti. In eleifend quam a odio. In hac habitasse platea dictumst.",,,Fee Charged,,,,,,Aonyx capensis,,,active,,https://nature.com/nunc/viverra/dapibus/nulla.aspx,"102-01,102-02,102-03,103-01"
151,136,,,,"Curabitur at ipsum ac tellus semper interdum. Mauris ullamcorper purus sit amet nulla. Quisque arcu libero, rutrum ac, lobortis vel, dapibus at, diam. Nam tristique tortor eu pede.",,,Free,,,,,,Morelia spilotes variegata,,,active,,http://sitemeter.com/nulla/nunc/purus/phasellus/in/felis/donec.js,"102-01,102-02,102-03,103-01"
152,137,,,,Pellentesque at nulla. Suspendisse potenti.,,,Free,,,,,,Spheniscus mendiculus,,,active,,https://senate.gov/semper/est/quam/pharetra/magna/ac.jsp,"101-09,102-01,102-02,102-03,103-01"
153,137,,,,"Ut at dolor quis odio consequat varius. Integer ac leo. Pellentesque ultrices mattis odio. Donec vitae nisi. Nam ultrices, libero non mattis pulvinar, nulla pede ullamcorper augue, a suscipit nulla elit ac nulla.",,,Free,,,,,,Paradoxurus hermaphroditus,,,active,,https://bravesites.com/cras.jpg,"101-09,102-01,102-02,102-03,103-01"
154,138,,,,"Lorem ipsum dolor sit amet, consectetuer adipiscing elit. Proin risus. Praesent lectus. Vestibulum quam sapien, varius ut, blandit non, interdum in, ante. Vestibulum ante ipsum primis in faucibus orci luctus et ultrices posuere cubilia Curae; Duis faucibus accumsan odio. Curabitur convallis.",,,Free,,,,,,Pelecans onocratalus,,,active,,https://amazonaws.com/pede.jsp,"101-02,101-03,101-11,101-12,101-13,102-01,102-02,102-03,103-01"
155,139,,,,"Curabitur in libero ut massa volutpat convallis. Morbi odio odio, elementum eu, interdum eu, tincidunt in, leo.",,,Free,,,,,,Ceratotherium simum,,,active,,https://parallels.com/nunc/donec/quis/orci/eget.xml,"101-09,101-10,102-01,102-02,102-03,103-02,103-04"
156,141,,,,"Curabitur in libero ut massa volutpat convallis. Morbi odio odio, elementum eu, interdum eu, tincidunt in, leo. Maecenas pulvinar lobortis est.",,,Fee Charged,,,,,,Boa constrictor mexicana,,,active,,https://icq.com/at.jpg,"101-09,101-09-10,102-01,102-02,102-03,103-02,103-04"
157,142,,,,"Nulla mollis molestie lorem. Quisque ut erat. Curabitur gravida nisi at nibh. In hac habitasse platea dictumst. Aliquam augue quam, sollicitudin vitae, consectetuer eget, rutrum at, lorem.",,,Free,,,,,,Lybius torquatus,,,active,,https://flickr.com/id/consequat/in/consequat.aspx,"101-09,102-01,102-02,102-03,103-02,103-04"
158,143,,,,Phasellus sit amet erat. Nulla tempus.,,,Free,,,,,,Colobus guerza,,,active,,http://boston.com/vitae/nisi.aspx,"101-02,101-03,101-11,101-12,101-13,102-01,102-02,102-03,103-02,103-04"
159,143,,,,"Vestibulum rutrum rutrum neque. Aenean auctor gravida sem. Praesent id massa id nisl venenatis lacinia. Aenean sit amet justo. Morbi ut odio. Cras mi pede, malesuada in, imperdiet et, commodo vulputate, justo. In blandit ultrices enim.",,,Free,,,,,,Podargus strigoides,,,active,,http://macromedia.com/tincidunt/nulla/mollis/molestie/lorem.png,"101-02,101-03,101-11,101-12,101-13,102-01,102-02,102-03,103-02,103-04"
160,144,,,,"Mauris enim leo, rhoncus sed, vestibulum sit amet, cursus id, turpis. Integer aliquet, massa id lobortis convallis, tortor risus dapibus augue, vel accumsan tellus nisi eu orci. Mauris lacinia sapien quis libero. Nullam sit amet turpis elementum ligula vehicula consequat.",,,Free,,,,,,Tockus erythrorhyncus,,,active,,https://google.co.uk/urna/pretium/nisl/ut/volutpat.jsp,"101-13,102-01,102-02,102-03,103-02,103-04"
161,144,,,,Mauris lacinia sapien quis libero. Nullam sit amet turpis elementum ligula vehicula consequat. Morbi a ipsum. Integer a nibh. In quis justo. Maecenas rhoncus aliquam lacus. Morbi quis tortor id nulla ultrices aliquet.,,,Free,,,,,,Chlidonias leucopterus,,,active,,http://wired.com/sociis.jsp,"101-13,102-01,102-02,102-03,103-02,103-04"
162,145,,,,"Cum sociis natoque penatibus et magnis dis parturient montes, nascetur ridiculus mus. Etiam vel augue. Vestibulum rutrum rutrum neque. Aenean auctor gravida sem. Praesent id massa id nisl venenatis lacinia. Aenean sit amet justo.",,,Fee Charged,,,,,,Melophus lathami,,,active,,https://adobe.com/in/imperdiet.aspx,"101-13,102-01,102-02,102-03,103-02,103-04"
163,146,,,,"Vivamus in felis eu sapien cursus vestibulum. Proin eu mi. Nulla ac enim. In tempor, turpis nec euismod scelerisque, quam turpis adipiscing lorem, vitae mattis nibh ligula nec sem. Duis aliquam convallis nunc. Proin at turpis a pede posuere nonummy.",,,Free,,,,,,Eremophila alpestris,,,active,,https://imageshack.us/quam/pharetra/magna/ac/consequat/metus/sapien.json,"101-09,102-01,102-02,102-03,103-02,103-04"
164,147,,,,"Duis at velit eu est congue elementum. In hac habitasse platea dictumst. Morbi vestibulum, velit id pretium iaculis, diam erat fermentum justo, nec condimentum neque sapien placerat ante. Nulla justo.",,,Free,,,,,,Podargus strigoides,,,active,,https://webnode.com/sociis/natoque/penatibus.xml,"101-09,101-10,102-01,102-02,102-03,103-02,103-04,104-02"
165,148,,,,Aenean sit amet justo.,,,Free,,,,,,Meleagris gallopavo,,,active,,https://exblog.jp/nullam/molestie/nibh.jsp,"101-13,102-01,102-02,102-03,103-02,103-04"
166,151,,,,"Praesent blandit lacinia erat. Vestibulum sed magna at nunc commodo placerat. Praesent blandit. Nam nulla. Integer pede justo, lacinia eget, tincidunt eget, tempus vel, pede. Morbi porttitor lorem id ligula.",,,Fee Charged,,,,,,Ovis musimon,,,active,,http://godaddy.com/non/mattis/pulvinar.jsp,"101-03,101-04,101-05,101-12,101-13,102-01,102-02,102-03,103-02,103-04"
167,152,,,,Phasellus sit amet erat. Nulla tempus. Vivamus in felis eu sapien cursus vestibulum.,,,Free,,,,,,Pseudalopex gymnocercus,,,active,,https://simplemachines.org/amet/erat/nulla/tempus/vivamus/in/felis.xml,"101-09,101-10,102-01,102-02,102-03,103-02,103-04"
168,153,,,,In congue. Etiam justo. Etiam pretium iaculis justo. In hac habitasse platea dictumst. Etiam faucibus cursus urna.,,,Free,,,,,,Cygnus atratus,,,active,,https://hugedomains.com/justo/sollicitudin/ut/suscipit/a/feugiat.aspx,"101-09,102-01,102-02,102-03,103-02,103-04"
169,153,,,,Duis at velit eu est congue elementum. In hac habitasse platea dictumst.,,,Free,,,,,,Dasypus septemcincus,,,active,,http://wiley.com/sit/amet/sapien/dignissim/vestibulum/vestibulum/ante.jsp,"101-09,102-01,102-02,102-03,103-02,103-04"
170,153,,,,"Aenean auctor gravida sem. Praesent id massa id nisl venenatis lacinia. Aenean sit amet justo. Morbi ut odio. Cras mi pede, malesuada in, imperdiet et, commodo vulputate, justo.",,,Free,,,,,,Hymenolaimus malacorhynchus,,,active,,https://dropbox.com/sapien/a/libero.jpg,"101-09,102-01,102-02,102-03,103-02,103-04"
171,154,,,,"Vestibulum quam sapien, varius ut, blandit non, interdum in, ante. Vestibulum ante ipsum primis in faucibus orci luctus et ultrices posuere cubilia Curae; Duis faucibus accumsan odio.",,,Free,,,,,,Bubo virginianus,,,active,,https://tamu.edu/faucibus/orci/luctus/et/ultrices/posuere/cubilia.png,"101-03,101-04,101-05,101-06,102-01,102-02,102-03,103-02,103-04"
172,154,,,,"Integer non velit. Donec diam neque, vestibulum eget, vulputate ut, ultrices vel, augue. Vestibulum ante ipsum primis in faucibus orci luctus et ultrices posuere cubilia Curae; Donec pharetra, magna vestibulum aliquet ultrices, erat tortor sollicitudin mi, sit amet lobortis sapien sapien non mi. Integer ac neque. Duis bibendum.",,,Fee Charged,,,,,,Numida meleagris,,,active,,http://aol.com/eros/viverra.json,"101-03,101-04,101-05,101-06,102-01,102-02,102-03,103-02,103-04"
173,154,,,,"Fusce congue, diam id ornare imperdiet, sapien urna pretium nisl, ut volutpat sapien arcu sed augue. Aliquam erat volutpat. In congue.",,,Free,,,,,,Ovis ammon,,,active,,https://squarespace.com/sapien.aspx,"101-03,101-04,101-05,101-06,102-01,102-02,102-03,103-02,103-04"
174,155,,,,"Sed ante. Vivamus tortor. Duis mattis egestas metus. Aenean fermentum. Donec ut mauris eget massa tempor convallis. Nulla neque libero, convallis eget, eleifend luctus, ultricies eu, nibh. Quisque id justo sit amet sapien dignissim vestibulum.",,,Fee Charged,,,,,,Anthropoides paradisea,,,active,,http://go.com/dictumst.jpg,"101-02,101-02-07,101-03,101-11,101-12,101-12-03,101-13,102-01,102-02,102-03,103-02"
175,156,,,,Sed ante. Vivamus tortor. Duis mattis egestas metus.,,,Free,,,,,,Otaria flavescens,,,active,,http://opensource.org/purus/aliquet.html,"101-09,101-09-09,102-01,102-02,102-03,103-02"
176,157,,,,"Mauris enim leo, rhoncus sed, vestibulum sit amet, cursus id, turpis. Integer aliquet, massa id lobortis convallis, tortor risus dapibus augue, vel accumsan tellus nisi eu orci. Mauris lacinia sapien quis libero.",,,Free,,,,,,Echimys chrysurus,,,active,,http://acquirethisname.com/magna/ac/consequat/metus/sapien.html,"101-02,101-11,101-12,101-13,102-01,102-02,102-03,103-02"
177,158,,,,Mauris ullamcorper purus sit amet nulla.,,,Free,,,,,,Merops bullockoides,,,active,,https://prweb.com/eget/rutrum/at/lorem/integer/tincidunt/ante.html,"101-02,101-03,101-11,101-12,101-12-02,101-13,102-01,102-02,102-03,103-02"
178,159,,,,"Vivamus in felis eu sapien cursus vestibulum. Proin eu mi. Nulla ac enim. In tempor, turpis nec euismod scelerisque, quam turpis adipiscing lorem, vitae mattis nibh ligula nec sem.",,,Fee Charged,,,,,,Iguana iguana,,,active,,https://ameblo.jp/proin/risus.aspx,"101-02,101-03,101-11,101-12,101-13,102-01,102-02,102-03,103-02"
179,160,,,,"Integer pede justo, lacinia eget, tincidunt eget, tempus vel, pede. Morbi porttitor lorem id ligula. Suspendisse ornare consequat lectus.",,,Free,,,,,,Ctenophorus ornatus,,,active,,https://1688.com/posuere/nonummy/integer/non/velit/donec.jsp,"101-02,101-03,101-11,101-12,101-12-01,101-13,102-01,102-02,102-03,103-02"
180,160,,,,"Vivamus metus arcu, adipiscing molestie, hendrerit at, vulputate vitae, nisl. Aenean lectus. Pellentesque eget nunc. Donec quis orci eget orci vehicula condimentum. Curabitur in libero ut massa volutpat convallis.",,,Fee Charged,,,,,,Nasua narica,,,active,,https://bloglines.com/aliquam/lacus/morbi.js,"101-02,101-03,101-11,101-12,101-12-01,101-13,102-01,102-02,102-03,103-02"
181,161,,,,"Proin leo odio, porttitor id, consequat in, consequat ut, nulla. Sed accumsan felis. Ut at dolor quis odio consequat varius. Integer ac leo. Pellentesque ultrices mattis odio. Donec vitae nisi. Nam ultrices, libero non mattis pulvinar, nulla pede ullamcorper augue, a suscipit nulla elit ac nulla.",,,Free,,,,,,unavailable,,,active,,https://homestead.com/sapien.xml,"101-04,101-08,102-01,102-02,102-03,103-02"
182,161,,,,"Integer aliquet, massa id lobortis convallis, tortor risus dapibus augue, vel accumsan tellus nisi eu orci. Mauris lacinia sapien quis libero. Nullam sit amet turpis elementum ligula vehicula consequat.",,,Free,,,,,,Castor canadensis,,,active,,https://comsenz.com/tincidunt/eu/felis/fusce/posuere.jsp,"101-04,101-08,102-01,102-02,102-03,103-02"
183,162,,,,"Donec vitae nisi. Nam ultrices, libero non mattis pulvinar, nulla pede ullamcorper augue, a suscipit nulla elit ac nulla. Sed vel enim sit amet nunc viverra dapibus.",,,Free,,,,,,Balearica pavonina,,,active,,https://mlb.com/lectus/vestibulum.jpg,"102-01,102-02,102-03,103-02"
184,162,,,,Phasellus sit amet erat. Nulla tempus.,,,Free,,,,,,Ovibos moschatus,,,active,,https://ihg.com/consectetuer/adipiscing/elit.html,"102-01,102-02,102-03,103-02"
185,163,,,,Nullam porttitor lacus at turpis.,,,Fee Charged,,,,,,Tapirus terrestris,,,active,,https://aboutads.info/nulla/tempus/vivamus.html,"102-01,102-02,102-03,103-02"
186,164,,,,"Mauris ullamcorper purus sit amet nulla. Quisque arcu libero, rutrum ac, lobortis vel, dapibus at, diam. Nam tristique tortor eu pede.",,,Free,,,,,,Chlamydosaurus kingii,,,active,,http://unesco.org/maecenas/ut/massa/quis/augue.json,"101-09,101-10,102-01,102-02,102-03,103-02,103-03"
187,165,,,,"Aliquam augue quam, sollicitudin vitae, consectetuer eget, rutrum at, lorem. Integer tincidunt ante vel ipsum.",,,Free,,,,,,Felis pardalis,,,active,,http://guardian.co.uk/pellentesque/ultrices/mattis.js,"101-02,101-03,101-11,101-12,101-13,102-01,102-02,102-03,103-02,103-03"
188,170,,,,"Nulla tempus. Vivamus in felis eu sapien cursus vestibulum. Proin eu mi. Nulla ac enim. In tempor, turpis nec euismod scelerisque, quam turpis adipiscing lorem, vitae mattis nibh ligula nec sem.",,,Free,,,,,,Macropus eugenii,,,active,,http://hugedomains.com/in/purus/eu/magna/vulputate/luctus.png,"101-09,101-10,102-01,102-02,102-03,103-02,103-03"
189,172,,,,Vestibulum ante ipsum primis in faucibus orci luctus et ultrices posuere cubilia Curae; Duis faucibus accumsan odio. Curabitur convallis.,,,Fee Charged,,,,,,Ursus arctos,,,active,,https://is.gd/erat/nulla/tempus/vivamus/in/felis.json,"101-03,101-04,101-07,102-01,102-02,102-03,103-02,103-03"
190,173,,,,In hac habitasse platea dictumst.,,,Free,,,,,,Aonyx cinerea,,,active,,http://google.co.uk/pede/posuere/nonummy/integer/non.html,"101-02,101-03,101-04,101-12,101-12-03,101-13,102-01,102-02,102-03,103-02,103-03"
191,174,,,,"Aliquam augue quam, sollicitudin vitae, consectetuer eget, rutrum at, lorem. Integer tincidunt ante vel ipsum. Praesent blandit lacinia erat. Vestibulum sed magna at nunc commodo placerat.",,,Free,,,,,,Columba livia,,,active,,http://bloomberg.com/luctus/rutrum/nulla/tellus/in.jsp,"101-02,101-03,101-11,101-12,101-13,102-01,102-02,102-03,103-02,103-03"
192,175,,,,Aliquam quis turpis eget elit sodales scelerisque. Mauris sit amet eros. Suspendisse accumsan tortor quis turpis. Sed ante.,,,Free,,,,,,Macaca radiata,,,active,,https://shutterfly.com/egestas/metus/aenean/fermentum.html,"101-13,102-01,102-02,102-03,103-02,103-03,104-05"
193,176,,,,"Donec diam neque, vestibulum eget, vulputate ut, ultrices vel, augue. Vestibulum ante ipsum primis in faucibus orci luctus et ultrices posuere cubilia Curae; Donec pharetra, magna vestibulum aliquet ultrices, erat tortor sollicitudin mi, sit amet lobortis sapien sapien non mi. Integer ac neque. Duis bibendum.",,,Fee Charged,,,,,,Ovis canadensis,,,active,,http://mozilla.com/tortor/eu.xml,"101-09,101-10,102-01,102-02,102-03,103-02,103-03"
194,176,,,,"Morbi vel lectus in quam fringilla rhoncus. Mauris enim leo, rhoncus sed, vestibulum sit amet, cursus id, turpis. Integer aliquet, massa id lobortis convallis, tortor risus dapibus augue, vel accumsan tellus nisi eu orci.",,,Free,,,,,,Odocoileus hemionus,,,active,,http://github.io/metus/vitae.jpg,"101-09,101-10,102-01,102-02,102-03,103-02,103-03"
195,177,,,,Aenean fermentum.,,,Free,,,,,,Trichoglossus chlorolepidotus,,,active,,http://time.com/ridiculus/mus/etiam/vel/augue/vestibulum/rutrum.xml,"101-03,101-04,101-05,101-12,101-12-02,102-01,102-02,102-03,103-02,103-03,104,104,104,104,104,104,104,104,104,104"
196,177,,,,"Maecenas leo odio, condimentum id, luctus nec, molestie sed, justo. Pellentesque viverra pede ac diam.",,,Fee Charged,,,,,,Gymnorhina tibicen,,,active,,http://yellowpages.com/nam/dui.js,"101-03,101-04,101-05,101-12,101-12-02,102-01,102-02,102-03,103-02,103-03,104,104,104,104,104,104,104,104,104,104"
197,178,,,,Vestibulum ante ipsum primis in faucibus orci luctus et ultrices posuere cubilia Curae; Mauris viverra diam vitae quam. Suspendisse potenti. Nullam porttitor lacus at turpis. Donec posuere metus vitae ipsum. Aliquam non mauris.,,,Free,,,,,,Pelecanus conspicillatus,,,active,,https://amazon.co.jp/id.js,"101-03,101-04,101-05,101-12,101-13,102-01,102-02,102-03,103-02,103-03"
198,180,,,,"Integer tincidunt ante vel ipsum. Praesent blandit lacinia erat. Vestibulum sed magna at nunc commodo placerat. Praesent blandit. Nam nulla. Integer pede justo, lacinia eget, tincidunt eget, tempus vel, pede.",,,Free,,,,,,Anastomus oscitans,,,active,,https://sogou.com/orci/vehicula/condimentum/curabitur.aspx,"102-01,102-02,102-03,103-02,103-03"
199,181,,,,"Vestibulum quam sapien, varius ut, blandit non, interdum in, ante. Vestibulum ante ipsum primis in faucibus orci luctus et ultrices posuere cubilia Curae; Duis faucibus accumsan odio. Curabitur convallis. Duis consequat dui nec nisi volutpat eleifend.",,,Fee Charged,,,,,,Lycaon pictus,,,active,,http://chron.com/eros/vestibulum/ac/est/lacinia/nisi.html,"101-02,101-03,101-11,101-12,101-13,102-01,102-02,102-03,103-04"
200,182,,,,Nulla justo. Aliquam quis turpis eget elit sodales scelerisque. Mauris sit amet eros.,,,Free,,,,,,Halcyon smyrnesis,,,active,,https://foxnews.com/morbi/quis/tortor/id.jpg,"101-02,101-03,101-04,101-11,101-12,101-12-01,101-13,102-01,102-02,102-03,103-04"
201,183,,,,Phasellus sit amet erat. Nulla tempus.,,,Free,,,,,,Martes americana,,,active,,https://vkontakte.ru/massa/donec/dapibus/duis/at/velit.html,"101-02,101-03,101-11,101-12,101-12-01,101-13,102-01,102-02,102-03,103-04"
202,184,,,,Praesent blandit lacinia erat.,,,Free,,,,,,Trichechus inunguis,,,active,,http://furl.net/condimentum/curabitur/in/libero.jpg,"101-13,102-01,102-02,102-03,103-04,104-07"
203,184,,,,Nullam sit amet turpis elementum ligula vehicula consequat. Morbi a ipsum. Integer a nibh. In quis justo.,,,Free,,,,,,Macropus robustus,,,active,,https://cdc.gov/dolor/quis/odio/consequat/varius.png,"101-13,102-01,102-02,102-03,103-04,104-07"
204,185,,,,In eleifend quam a odio. In hac habitasse platea dictumst. Maecenas ut massa quis augue luctus tincidunt. Nulla mollis molestie lorem. Quisque ut erat. Curabitur gravida nisi at nibh.,,,Fee Charged,,,,,,Bettongia penicillata,,,active,,https://cpanel.net/dignissim/vestibulum/vestibulum/ante/ipsum/primis/in.js,"101-02,101-11,101-12,101-12-03,101-13,102-01,102-02,102-03,103-04"
205,186,,,,Morbi a ipsum. Integer a nibh. In quis justo.,,,Free,,,,,,Crotalus adamanteus,,,active,,https://nbcnews.com/amet/nulla/quisque/arcu.js,"101-02,101-11,101-12,101-12-03,101-13,102-01,102-02,102-03,103-04"
206,188,,,,Nullam molestie nibh in lectus. Pellentesque at nulla. Suspendisse potenti. Cras in purus eu magna vulputate luctus.,,,Free,,,,,,Globicephala melas,,,active,,https://ihg.com/dolor.jsp,"102-01,102-02,102-03,103-04"
207,188,,,,"Nulla ac enim. In tempor, turpis nec euismod scelerisque, quam turpis adipiscing lorem, vitae mattis nibh ligula nec sem. Duis aliquam convallis nunc.",,,Fee Charged,,,,,,Hippotragus equinus,,,active,,https://webnode.com/quisque/id/justo/sit/amet.png,"102-01,102-02,102-03,103-04"
208,189,,,,"Morbi odio odio, elementum eu, interdum eu, tincidunt in, leo. Maecenas pulvinar lobortis est. Phasellus sit amet erat.",,,Free,,,,,,Numida meleagris,,,active,,https://aboutads.info/eu/orci/mauris.jpg,"101-02,101-03,101-11,101-12,101-12-01,101-13,102-01,102-02,102-03,103-04"
209,189,,,,Etiam justo. Etiam pretium iaculis justo.,,,Free,,,,,,Sus scrofa,,,active,,https://un.org/morbi/odio.html,"101-02,101-03,101-11,101-12,101-12-01,101-13,102-01,102-02,102-03,103-04"
210,190,,,,Donec semper sapien a libero.,,,Free,,,,,,Creagrus furcatus,,,active,,http://examiner.com/sit/amet/diam/in/magna/bibendum.jsp,"101-03,101-04,101-07,101-07-02,102-01,102-02,102-03,103-04"
211,190,,,,"In blandit ultrices enim. Lorem ipsum dolor sit amet, consectetuer adipiscing elit. Proin interdum mauris non ligula pellentesque ultrices. Phasellus id sapien in sapien iaculis congue. Vivamus metus arcu, adipiscing molestie, hendrerit at, vulputate vitae, nisl. Aenean lectus.",,,Free,,,,,,Ardea cinerea,,,active,,http://weather.com/ut/dolor/morbi/vel/lectus.html,"101-03,101-04,101-07,101-07-02,102-01,102-02,102-03,103-04"
212,190,,,,Etiam faucibus cursus urna. Ut tellus. Nulla ut erat id mauris vulputate elementum. Nullam varius. Nulla facilisi. Cras non velit nec nisi vulputate nonummy.,,,Free,,,,,,Ceratotherium simum,,,active,,http://nifty.com/consequat/lectus/in/est.png,"101-03,101-04,101-07,101-07-02,102-01,102-02,102-03,103-04"
213,191,,,,Ut tellus.,,,Fee Charged,,,,,,Lophoaetus occipitalis,,,active,,https://themeforest.net/ut/blandit/non.jpg,"101-13,102-01,102-02,102-03,103-04"
214,192,,,,"Nam ultrices, libero non mattis pulvinar, nulla pede ullamcorper augue, a suscipit nulla elit ac nulla.",,,Free,,,,,,Ursus arctos,,,active,,http://google.nl/non/pretium/quis/lectus.js,"101-02,101-02-09,101-03,101-04,101-12,101-12-03,101-13,102-01,102-02,102-03,103-04,104-09"
