id,location_id,program_id,accepted_payments,alternate_name,description,eligibility,email,fees,funding_sources,application_process,interpretation_sources,keywords,languages,name,required_documents,service_areas,status,wait_time,website,taxonomy_ids
73,78,,,,"Mauris enim leo, rhoncus sed, vestibulum sit amet, cursus id, turpis. Integer aliquet, massa id lobortis convallis, tortor risus dapibus augue, vel accumsan tellus nisi eu orci. Mauris lacinia sapien quis libero. Nullam sit amet turpis elementum ligula vehicula consequat. Morbi a ipsum. Integer a nibh.",,,Fee Charged,,,,,,Ratufa indica,,,active,,https://buzzfeed.com/rhoncus/dui/vel/sem/sed.aspx,"101-03,101-04,101-05,101-12,101-13,102-01,102-02,102-03,103-03,103-04"
74,79,,,,"Nullam orci pede, venenatis non, sodales sed, tincidunt eu, felis. Fusce posuere felis sed lacus. Morbi sem mauris, laoreet ut, rhoncus aliquet, pulvinar sed, nisl. Nunc rhoncus dui vel sem.",,,Free,,,,,,Myrmecophaga tridactyla,,,active,,https://miibeian.gov.cn/platea/dictumst/etiam.js,"101-02,101-11,101-12,101-13,102-01,102-02,102-03,103-03,103-04,104-07"
75,80,,,,"Phasellus in felis. Donec semper sapien a libero. Nam dui. Proin leo odio, porttitor id, consequat in, consequat ut, nulla.",,,Free,,,,,,Haliaetus leucogaster,,,active,,http://abc.net.au/in/consequat/ut/nulla/sed/accumsan/felis.jsp,"101-02,101-03,101-04,101-12,101-12-03,101-13,102-01,102-02,102-03,103-04"
76,81,,,,Suspendisse accumsan tortor quis turpis.,,,Free,,,,,,Lorythaixoides concolor,,,active,,https://mac.com/in/sapien/iaculis/congue/vivamus/metus/arcu.xml,"101-03,101-04,101-07,102-01,102-02,102-03,103-04"
77,82,,,,Aenean lectus. Pellentesque eget nunc.,,,Fee Charged,,,,,,Isoodon obesulus,,,active,,http://wufoo.com/feugiat.jpg,"101-13,102-01,102-02,102-03,103-04"
78,84,,,,"Nunc purus. Phasellus in felis. Donec semper sapien a libero. Nam dui. Proin leo odio, porttitor id, consequat in, consequat ut, nulla. Sed accumsan felis.",,,Free,,,,,,Corythornis cristata,,,active,,http://sakura.ne.jp/vel/pede/morbi/porttitor.js,"101-03,101-04,101-05,101-06,102-01,102-02,102-03,103-04"
79,85,,,,"In hac habitasse platea dictumst. Morbi vestibulum, velit id pretium iaculis, diam erat fermentum justo, nec condimentum neque sapien placerat ante. Nulla justo.",,,Free,,,,,,Tockus flavirostris,,,active,,https://simplemachines.org/platea/dictumst.aspx,"101-04,101-08,102-01,102-02,102-03,103-04,104-03"
80,86,,,,"In sagittis dui vel nisl. Duis ac nibh. Fusce lacus purus, aliquet at, feugiat non, pretium quis, lectus. Suspendisse potenti. In eleifend quam a odio. In hac habitasse platea dictumst.",,,Free,,,,,,Dasyurus viverrinus,,,active,,https://ycombinator.com/morbi/non/lectus/aliquam/sit.xml,"101-02,101-02-03,101-11,101-12,101-12-01,101-13,102-01,102-02,102-03,103-04"
81,87,,,,Nulla ut erat id mauris vulputate elementum. Nullam varius. Nulla facilisi.,,,Fee Charged,,,,,,Larus fuliginosus,,,active,,http://nyu.edu/dolor.json,"101-04,101-08,102-01,102-02,102-03,103-04"
82,87,,,,Nunc purus. Phasellus in felis. Donec semper sapien a libero. Nam dui.,,,Free,,,,,,Service Name,,,active,,https://wiley.com/ut/massa/volutpat.jpg,"101-04,101-08,102-01,102-02,102-03,103-04"
83,87,,,,"Lorem ipsum dolor sit amet, consectetuer adipiscing elit. Proin interdum mauris non ligula pellentesque ultrices. Phasellus id sapien in sapien iaculis congue.",,,Free,,,,,,Kobus leche robertsi,,,active,,https://arizona.edu/lacinia/erat/vestibulum.jpg,"101-04,101-08,102-01,102-02,102-03,103-04"
84,87,,,,"Donec ut dolor. Morbi vel lectus in quam fringilla rhoncus. Mauris enim leo, rhoncus sed, vestibulum sit amet, cursus id, turpis. Integer aliquet, massa id lobortis convallis, tortor risus dapibus augue, vel accumsan tellus nisi eu orci. Mauris lacinia sapien quis libero. Nullam sit amet turpis elementum ligula vehicula consequat.",,,Free,,,,,,Lorythaixoides concolor,,,active,,http://noaa.gov/amet/eleifend/pede/libero/quis.jpg,"101-04,101-08,102-01,102-02,102-03,103-04"
85,88,,,,"In quis justo. Maecenas rhoncus aliquam lacus. Morbi quis tortor id nulla ultrices aliquet. Maecenas leo odio, condimentum id, luctus nec, molestie sed, justo. Pellentesque viverra pede ac diam. Cras pellentesque volutpat dui. Maecenas tristique, est et tempus semper, est quam pharetra magna, ac consequat metus sapien ut nunc.",,,Free,,,,,,Ara macao,,,active,,https://about.me/in/faucibus/orci/luctus/et/ultrices/posuere.jsp,"101-03,101-04,101-07,102-01,102-02,102-03,103-04"
86,88,,,,Morbi a ipsum. Integer a nibh. In quis justo. Maecenas rhoncus aliquam lacus.,,,Free,,,,,,Ateles paniscus,,,active,,https://bandcamp.com/congue/etiam/justo/etiam/pretium.js,"101-03,101-04,101-07,102-01,102-02,102-03,103-04"
87,88,,,,"Cras in purus eu magna vulputate luctus. Cum sociis natoque penatibus et magnis dis parturient montes, nascetur ridiculus mus. Vivamus vestibulum sagittis sapien. Cum sociis natoque penatibus et magnis dis parturient montes, nascetur ridiculus mus. Etiam vel augue. Vestibulum rutrum rutrum neque. Aenean auctor gravida sem.",,,Free,,,,,,Naja nivea,,,active,,https://istockphoto.com/ac/neque/duis/bibendum/morbi.jpg,"101-03,101-04,101-07,102-01,102-02,102-03,103-04"
88,89,,,,"Pellentesque viverra pede ac diam. Cras pellentesque volutpat dui. Maecenas tristique, est et tempus semper, est quam pharetra magna, ac consequat metus sapien ut nunc. Vestibulum ante ipsum primis in faucibus orci luctus et ultrices posuere cubilia Curae; Mauris viverra diam vitae quam.",,,Free,,,,,,Zonotrichia capensis,,,active,,http://spotify.com/vestibulum/ante.xml,"101-03,101-04,101-07,101-07-01,102-01,102-02,102-03,103-04"
89,89,,,,"Quisque id justo sit amet sapien dignissim vestibulum. Vestibulum ante ipsum primis in faucibus orci luctus et ultrices posuere cubilia Curae; Nulla dapibus dolor vel est. Donec odio justo, sollicitudin ut, suscipit a, feugiat et, eros. Vestibulum ac est lacinia nisi venenatis tristique. Fusce congue, diam id ornare imperdiet, sapien urna pretium nisl, ut volutpat sapien arcu sed augue. Aliquam erat volutpat.",,,Free,,,,,,Tragelaphus strepsiceros,,,active,,http://paypal.com/porttitor/pede/justo/eu.js,"101-03,101-04,101-07,101-07-01,102-01,102-02,102-03,103-04"
90,89,,,,"Nam congue, risus semper porta volutpat, quam pede lobortis ligula, sit amet eleifend pede libero quis orci. Nullam molestie nibh in lectus. Pellentesque at nulla. Suspendisse potenti. Cras in purus eu magna vulputate luctus. Cum sociis natoque penatibus et magnis dis parturient montes, nascetur ridiculus mus.",,,Free,,,,,,Manouria emys,,,active,,https://miibeian.gov.cn/sapien/ut/nunc/vestibulum/ante.png,"101-03,101-04,101-07,101-07-01,102-01,102-02,102-03,103-04"
91,90,,,,"Sed sagittis. Nam congue, risus semper porta volutpat, quam pede lobortis ligula, sit amet eleifend pede libero quis orci. Nullam molestie nibh in lectus.",,,Free,,,,,,Macaca nemestrina,,,active,,http://guardian.co.uk/proin.html,"101-03,101-04,101-07,101-07-01,102-01,102-02,102-03,103-04"
92,90,,,,Maecenas ut massa quis augue luctus tincidunt. Nulla mollis molestie lorem. Quisque ut erat.,,,Fee Charged,,,,,,Microcebus murinus,,,active,,http://mac.com/nulla/sed.html,"101-03,101-04,101-07,101-07-01,102-01,102-02,102-03,103-04"
93,90,,,,Nulla justo.,,,Fee Charged,,,,,,Chelodina longicollis,,,active,,https://wordpress.org/odio/cras/mi.jsp,"101-03,101-04,101-07,101-07-01,102-01,102-02,102-03,103-04"
94,91,,,,"Vestibulum sed magna at nunc commodo placerat. Praesent blandit. Nam nulla. Integer pede justo, lacinia eget, tincidunt eget, tempus vel, pede. Morbi porttitor lorem id ligula. Suspendisse ornare consequat lectus.",,,Fee Charged,,,,,,Macropus fuliginosus,,,active,,http://army.mil/ridiculus/mus/etiam/vel/augue/vestibulum/rutrum.xml,"101-02,101-03,101-03-10,101-04,101-11,101-12,101-13,102-01,102-02,102-03,103-04"
95,92,,,,Phasellus in felis.,,,Free,,,,,,Nectarinia chalybea,,,active,,https://cdc.gov/nisl/venenatis/lacinia/aenean/sit/amet/justo.html,"101-02,101-03,101-11,101-11-06,101-12,101-12-03,101-13,102-01,102-02,102-03,103-04"
96,93,,,,Donec semper sapien a libero. Nam dui.,,,Free,,,,,,Felis rufus,,,active,,https://purevolume.com/platea/dictumst/maecenas.json,"101-04,101-08,102-01,102-02,102-03,103-04"
97,95,,,,"Quisque erat eros, viverra eget, congue eget, semper rutrum, nulla.",,,Free,,,,,,Threskionis aethiopicus,,,active,,http://networkadvertising.org/neque.xml,"101-02,101-13,102-01,102-02,102-03,103-04"
98,96,,,,"Cras mi pede, malesuada in, imperdiet et, commodo vulputate, justo. In blandit ultrices enim. Lorem ipsum dolor sit amet, consectetuer adipiscing elit. Proin interdum mauris non ligula pellentesque ultrices. Phasellus id sapien in sapien iaculis congue. Vivamus metus arcu, adipiscing molestie, hendrerit at, vulputate vitae, nisl. Aenean lectus.",,,Fee Charged,,,,,,Tiliqua scincoides,,,active,,https://joomla.org/vestibulum/quam/sapien/varius/ut/blandit.aspx,"101-09,101-10,102-01,102-02,102-03,103-04"
99,97,,,,Cras non velit nec nisi vulputate nonummy.,,,Free,,,,,,Catharacta skua,,,active,,https://earthlink.net/id/mauris/vulputate/elementum/nullam/varius/nulla.png,"101-03,101-04,101-07,102-01,102-02,102-03,103-04"
100,98,,,,"Morbi ut odio. Cras mi pede, malesuada in, imperdiet et, commodo vulputate, justo. In blandit ultrices enim. Lorem ipsum dolor sit amet, consectetuer adipiscing elit. Proin interdum mauris non ligula pellentesque ultrices. Phasellus id sapien in sapien iaculis congue.",,,Free,,,,,,Tragelaphus strepsiceros,,,active,,http://cnbc.com/cubilia/curae.js,"101-03,101-04,101-05,101-05-04,101-06,102-01,102-02,102-03,103-04"
101,99,,,,"Sed sagittis. Nam congue, risus semper porta volutpat, quam pede lobortis ligula, sit amet eleifend pede libero quis orci. Nullam molestie nibh in lectus. Pellentesque at nulla. Suspendisse potenti. Cras in purus eu magna vulputate luctus. Cum sociis natoque penatibus et magnis dis parturient montes, nascetur ridiculus mus.",,,Free,,,,,,Ursus maritimus,,,active,,https://tamu.edu/metus/sapien/ut/nunc/vestibulum/ante.js,"101-02,101-12,101-12-03,101-13,102-01,102-02,102-03,103-04"
102,100,,,,"Nam congue, risus semper porta volutpat, quam pede lobortis ligula, sit amet eleifend pede libero quis orci. Nullam molestie nibh in lectus. Pellentesque at nulla.",,,Fee Charged,,,,,,Ovis dalli stonei,,,active,,http://jigsy.com/erat/id/mauris/vulputate/elementum/nullam.xml,"101-03,101-04,101-12,101-13,102-01,102-02,102-03,103-04"
103,101,,,,Sed ante. Vivamus tortor. Duis mattis egestas metus. Aenean fermentum.,,,Free,,,,,,Spermophilus lateralis,,,active,,http://github.io/tortor.aspx,"101-09,101-10,102-01,102-02,102-03,103-04"
104,102,,,,Pellentesque ultrices mattis odio.,,,Free,,,,,,Lama guanicoe,,,active,,https://blogtalkradio.com/bibendum.js,"101-09,102-01,102-02,102-03,103-02,103-03,103-04"
105,104,,,,Donec posuere metus vitae ipsum. Aliquam non mauris. Morbi non lectus.,,,Free,,,,,,Tapirus terrestris,,,active,,http://ycombinator.com/sociis/natoque/penatibus.json,"101-02,101-03,101-11,101-12,101-13,102-01,102-02,102-03,103-02,103-03,103-04"
106,105,,,,"In est risus, auctor sed, tristique in, tempus sit amet, sem. Fusce consequat. Nulla nisl. Nunc nisl. Duis bibendum, felis sed interdum venenatis, turpis enim blandit mi, in porttitor pede justo eu massa. Donec dapibus.",,,Fee Charged,,,,,,Tamandua tetradactyla,,,active,,https://ebay.com/tincidunt/lacus/at/velit/vivamus.jsp,"101-02,101-03,101-11,101-12,101-13,102-01,102-02,102-03,103-02,103-03,103-04"
107,106,,,,In eleifend quam a odio. In hac habitasse platea dictumst. Maecenas ut massa quis augue luctus tincidunt. Nulla mollis molestie lorem. Quisque ut erat. Curabitur gravida nisi at nibh. In hac habitasse platea dictumst.,,,Free,,,,,,Alopex lagopus,,,active,,http://google.com.br/malesuada/in/imperdiet/et.png,"101-04,101-08,102-01,102-02,102-03,103-02,103-03,103-04"
108,107,,,,Duis bibendum. Morbi non quam nec dui luctus rutrum. Nulla tellus.,,,Free,,,,,,unavailable,,,active,,http://spiegel.de/pellentesque/at.aspx,"101-04,101-08,102-01,102-02,102-03,103-02,103-03,103-04"
109,108,,,,Vestibulum rutrum rutrum neque.,,,Free,,,,,,Milvago chimachima,,,active,,https://cdc.gov/turpis.png,"101-02,101-03,101-04,101-12,101-12-02,101-13,102-01,102-02,102-03,103-02,103-03,103-04"
110,109,,,,"Maecenas leo odio, condimentum id, luctus nec, molestie sed, justo. Pellentesque viverra pede ac diam. Cras pellentesque volutpat dui. Maecenas tristique, est et tempus semper, est quam pharetra magna, ac consequat metus sapien ut nunc. Vestibulum ante ipsum primis in faucibus orci luctus et ultrices posuere cubilia Curae; Mauris viverra diam vitae quam.",,,Fee Charged,,,,,,Gyps bengalensis,,,active,,http://1688.com/ultrices/erat/tortor/sollicitudin/mi/sit/amet.html,"101-03,101-04,101-07,102-01,102-02,102-03,103-02,103-03,103-04"
111,109,,,,"Integer tincidunt ante vel ipsum. Praesent blandit lacinia erat. Vestibulum sed magna at nunc commodo placerat. Praesent blandit. Nam nulla. Integer pede justo, lacinia eget, tincidunt eget, tempus vel, pede.",,,Free,,,,,,Semnopithecus entellus,,,active,,https://edublogs.org/blandit/non/interdum/in/ante/vestibulum/ante.json,"101-03,101-04,101-07,102-01,102-02,102-03,103-02,103-03,103-04"
112,109,,,,Vestibulum ante ipsum primis in faucibus orci luctus et ultrices posuere cubilia Curae; Mauris viverra diam vitae quam. Suspendisse potenti. Nullam porttitor lacus at turpis. Donec posuere metus vitae ipsum. Aliquam non mauris. Morbi non lectus. Aliquam sit amet diam in magna bibendum imperdiet.,,,Free,,,,,,Plegadis falcinellus,,,active,,http://wp.com/rhoncus/aliquet/pulvinar/sed/nisl/nunc/rhoncus.html,"101-03,101-04,101-07,102-01,102-02,102-03,103-02,103-03,103-04"
113,109,,,,"Maecenas tristique, est et tempus semper, est quam pharetra magna, ac consequat metus sapien ut nunc. Vestibulum ante ipsum primis in faucibus orci luctus et ultrices posuere cubilia Curae; Mauris viverra diam vitae quam. Suspendisse potenti. Nullam porttitor lacus at turpis.",,,Free,,,,,,Anitibyx armatus,,,active,,http://pinterest.com/malesuada/in/imperdiet/et/commodo/vulputate.js,"101-03,101-04,101-07,102-01,102-02,102-03,103-02,103-03,103-04"
114,109,,,,"Donec ut mauris eget massa tempor convallis. Nulla neque libero, convallis eget, eleifend luctus, ultricies eu, nibh.",,,Free,,,,,,Service Name,,,active,,http://nifty.com/augue/vel.png,"101-03,101-04,101-07,102-01,102-02,102-03,103-02,103-03,103-04"
115,110,,,,Maecenas tincidunt lacus at velit. Vivamus vel nulla eget eros elementum pellentesque.,,,Free,,,,,,Delphinus delphis,,,active,,https://amazon.de/velit/id/pretium/iaculis/diam.json,"101-02,101-03,101-04,101-12,101-12-01,101-13,101-13-06,102-01,102-02,102-03,103-02,103-03,103-04"
116,110,,,,"Nam dui. Proin leo odio, porttitor id, consequat in, consequat ut, nulla. Sed accumsan felis.",,,Free,,,,,,Otocyon megalotis,,,active,,https://house.gov/in/hac/habitasse/platea.aspx,"101-02,101-03,101-04,101-12,101-12-01,101-13,101-13-06,102-01,102-02,102-03,103-02,103-03,103-04"
117,110,,,,Nulla facilisi. Cras non velit nec nisi vulputate nonummy. Maecenas tincidunt lacus at velit.,,,Fee Charged,,,,,,Isoodon obesulus,,,active,,http://discovery.com/vivamus.jpg,"101-02,101-03,101-04,101-12,101-12-01,101-13,101-13-06,102-01,102-02,102-03,103-02,103-03,103-04"
118,111,,,,"Maecenas rhoncus aliquam lacus. Morbi quis tortor id nulla ultrices aliquet. Maecenas leo odio, condimentum id, luctus nec, molestie sed, justo. Pellentesque viverra pede ac diam. Cras pellentesque volutpat dui. Maecenas tristique, est et tempus semper, est quam pharetra magna, ac consequat metus sapien ut nunc.",,,Free,,,,,,Varanus salvator,,,active,,https://ed.gov/sollicitudin/ut.html,"101-02,101-03,101-04,101-12,101-13,102-01,102-02,102-03,103-02,103-03,103-04"
119,111,,,,"Integer aliquet, massa id lobortis convallis, tortor risus dapibus augue, vel accumsan tellus nisi eu orci. Mauris lacinia sapien quis libero. Nullam sit amet turpis elementum ligula vehicula consequat. Morbi a ipsum. Integer a nibh. In quis justo. Maecenas rhoncus aliquam lacus.",,,Fee Charged,,,,,,Lorythaixoides concolor,,,active,,https://cdbaby.com/nulla/nisl/nunc/nisl/duis/bibendum.png,"101-02,101-03,101-04,101-12,101-13,102-01,102-02,102-03,103-02,103-03,103-04"
120,111,,,,Morbi vel lectus in quam fringilla rhoncus.,,,Free,,,,,,Zalophus californicus,,,active,,https://shinystat.com/in/congue/etiam/justo/etiam/pretium.xml,"101-02,101-03,101-04,101-12,101-13,102-01,102-02,102-03,103-02,103-03,103-04"
121,112,,,,"Maecenas pulvinar lobortis est. Phasellus sit amet erat. Nulla tempus. Vivamus in felis eu sapien cursus vestibulum. Proin eu mi. Nulla ac enim. In tempor, turpis nec euismod scelerisque, quam turpis adipiscing lorem, vitae mattis nibh ligula nec sem.",,,Free,,,,,,Kobus defassa,,,active,,https://mapy.cz/quam/fringilla.js,"101-04,101-08,102-01,102-02,102-03,103-02,103-03,103-04,104-07"
122,115,,,,"Donec diam neque, vestibulum eget, vulputate ut, ultrices vel, augue.",,,Fee Charged,,,,,,Vulpes chama,,,active,,http://phpbb.com/mattis/egestas/metus.jpg,"101-03,101-03-07,101-04,101-05,101-06,102-01,102-02,102-03,103-02,103-03,103-04"
123,117,,,,Cras in purus eu magna vulputate luctus.,,,Free,,,,,,Paroaria gularis,,,active,,http://etsy.com/scelerisque.js,"101-03,101-04,101-07,102-01,102-02,102-03,103-02,103-03,103-04"
124,118,,,,"Praesent blandit lacinia erat. Vestibulum sed magna at nunc commodo placerat. Praesent blandit. Nam nulla. Integer pede justo, lacinia eget, tincidunt eget, tempus vel, pede. Morbi porttitor lorem id ligula.",,,Free,,,,,,Pterocles gutturalis,,,active,,http://dailymotion.com/consequat/ut/nulla/sed/accumsan/felis.jsp,"101-13,102-01,102-02,102-03,103-02,103-03,103-04"
125,119,,,,Morbi non lectus.,,,Free,,,,,,Spermophilus richardsonii,,,active,,https://unesco.org/penatibus/et/magnis/dis/parturient.aspx,"101-09,102-01,102-02,102-03,103-02,103-03,103-04,104-04"
126,120,,,,Integer ac neque. Duis bibendum. Morbi non quam nec dui luctus rutrum. Nulla tellus.,,,Fee Charged,,,,,,Deroptyus accipitrinus,,,active,,http://wiley.com/justo/lacinia.png,"101-02,101-03,101-11,101-12,101-13,102-01,102-02,102-03,103-02,103-03,103-04"
127,121,,,,"Morbi porttitor lorem id ligula. Suspendisse ornare consequat lectus. In est risus, auctor sed, tristique in, tempus sit amet, sem. Fusce consequat. Nulla nisl. Nunc nisl. Duis bibendum, felis sed interdum venenatis, turpis enim blandit mi, in porttitor pede justo eu massa.",,,Free,,,,,,Choriotis kori,,,active,,https://slideshare.net/vel/dapibus/at/diam.aspx,"101-09,101-10,101-10-06,102-01,102-02,102-03,103-02,103-03,103-04"
128,121,,,,"Morbi ut odio. Cras mi pede, malesuada in, imperdiet et, commodo vulputate, justo. In blandit ultrices enim.",,,Free,,,,,,Colobus guerza,,,active,,https://miibeian.gov.cn/varius.json,"101-09,101-10,101-10-06,102-01,102-02,102-03,103-02,103-03,103-04"
129,122,,,,Vestibulum ante ipsum primis in faucibus orci luctus et ultrices posuere cubilia Curae; Mauris viverra diam vitae quam.,,,Free,,,,,,Gyps bengalensis,,,active,,https://weebly.com/quam/pharetra/magna/ac/consequat/metus/sapien.png,"101-04,101-08,102-01,102-02,102-03,103-02,103-03,103-04"
130,122,,,,"Vivamus in felis eu sapien cursus vestibulum. Proin eu mi. Nulla ac enim. In tempor, turpis nec euismod scelerisque, quam turpis adipiscing lorem, vitae mattis nibh ligula nec sem. Duis aliquam convallis nunc. Proin at turpis a pede posuere nonummy. Integer non velit.",,,Free,,,,,,Lasiodora parahybana,,,active,,http://slideshare.net/cum.aspx,"101-04,101-08,102-01,102-02,102-03,103-02,103-03,103-04"
131,123,,,,"Phasellus sit amet erat. Nulla tempus. Vivamus in felis eu sapien cursus vestibulum. Proin eu mi. Nulla ac enim. In tempor, turpis nec euismod scelerisque, quam turpis adipiscing lorem, vitae mattis nibh ligula nec sem. Duis aliquam convallis nunc.",,,Free,,,,,,Meles meles,,,active,,https://weibo.com/dapibus/augue/vel/accumsan/tellus/nisi/eu.xml,"101-09,102-01,102-02,102-03,103-02,103-03,103-04"
132,124,,,,"Cum sociis natoque penatibus et magnis dis parturient montes, nascetur ridiculus mus. Vivamus vestibulum sagittis sapien. Cum sociis natoque penatibus et magnis dis parturient montes, nascetur ridiculus mus. Etiam vel augue.",,,Fee Charged,,,,,,Nyctereutes procyonoides,,,active,,http://alibaba.com/aliquet/massa/id/lobortis/convallis/tortor.jsp,"101-13,102-01,102-02,102-03,103-02,103-03,103-04"
133,125,,,,Integer a nibh. In quis justo. Maecenas rhoncus aliquam lacus. Morbi quis tortor id nulla ultrices aliquet.,,,Free,,,,,,Sciurus vulgaris,,,active,,https://gizmodo.com/magnis/dis/parturient.jsp,"101-02,101-03,101-04,101-12,101-13,102-01,102-02,102-03,103-01"
134,126,,,,"In quis justo. Maecenas rhoncus aliquam lacus. Morbi quis tortor id nulla ultrices aliquet. Maecenas leo odio, condimentum id, luctus nec, molestie sed, justo. Pellentesque viverra pede ac diam. Cras pellentesque volutpat dui. Maecenas tristique, est et tempus semper, est quam pharetra magna, ac consequat metus sapien ut nunc.",,,Free,,,,,,Panthera pardus,,,active,,http://dropbox.com/at/ipsum/ac/tellus/semper/interdum/mauris.jpg,"101-09,101-10,102-01,102-02,102-03,103-01"
135,129,,,,"Vestibulum ante ipsum primis in faucibus orci luctus et ultrices posuere cubilia Curae; Duis faucibus accumsan odio. Curabitur convallis. Duis consequat dui nec nisi volutpat eleifend. Donec ut dolor. Morbi vel lectus in quam fringilla rhoncus. Mauris enim leo, rhoncus sed, vestibulum sit amet, cursus id, turpis.",,,Free,,,,,,Podargus strigoides,,,active,,http://ezinearticles.com/aliquet/at/feugiat/non/pretium/quis.json,"101-03,101-04,101-05,101-05-05,101-12,102-01,102-02,102-03,103-01"
136,129,,,,"Integer pede justo, lacinia eget, tincidunt eget, tempus vel, pede. Morbi porttitor lorem id ligula. Suspendisse ornare consequat lectus. In est risus, auctor sed, tristique in, tempus sit amet, sem. Fusce consequat.",,,Fee Charged,,,,,,Anas punctata,,,active,,http://furl.net/id/turpis/integer/aliquet.json,"101-03,101-04,101-05,101-05-05,101-12,102-01,102-02,102-03,103-01"
137,130,,,,Cras in purus eu magna vulputate luctus.,,,Fee Charged,,,,,,Nannopterum harrisi,,,active,,https://goo.gl/porttitor.xml,"101-02,101-11,101-12,101-13,102-01,102-02,102-03,103-01"
138,130,,,,"Duis bibendum, felis sed interdum venenatis, turpis enim blandit mi, in porttitor pede justo eu massa. Donec dapibus. Duis at velit eu est congue elementum. In hac habitasse platea dictumst. Morbi vestibulum, velit id pretium iaculis, diam erat fermentum justo, nec condimentum neque sapien placerat ante. Nulla justo. Aliquam quis turpis eget elit sodales scelerisque.",,,Free,,,,,,Trachyphonus vaillantii,,,active,,https://miitbeian.gov.cn/vivamus/metus/arcu/adipiscing.aspx,"101-02,101-11,101-12,101-13,102-01,102-02,102-03,103-01"
139,131,,,,Duis mattis egestas metus. Aenean fermentum.,,,Free,,,,,,Larus fuliginosus,,,active,,http://smh.com.au/magna/ac.jsp,"101-03,101-04,101-07,102-01,102-02,102-03,103-01"
140,131,,,,"Donec ut dolor. Morbi vel lectus in quam fringilla rhoncus. Mauris enim leo, rhoncus sed, vestibulum sit amet, cursus id, turpis. Integer aliquet, massa id lobortis convallis, tortor risus dapibus augue, vel accumsan tellus nisi eu orci. Mauris lacinia sapien quis libero.",,,Fee Charged,,,,,,Charadrius tricollaris,,,active,,https://list-manage.com/convallis/eget/eleifend/luctus/ultricies/eu/nibh.aspx,"101-03,101-04,101-07,102-01,102-02,102-03,103-01"
141,131,,,,Vestibulum sed magna at nunc commodo placerat. Praesent blandit.,,,Free,,,,,,Felis wiedi or Leopardus weidi,,,active,,https://msu.edu/libero.xml,"101-03,101-04,101-07,102-01,102-02,102-03,103-01"
142,132,,,,In congue. Etiam justo. Etiam pretium iaculis justo. In hac habitasse platea dictumst.,,,Fee Charged,,,,,,Falco peregrinus,,,active,,http://seesaa.net/in/felis/donec/semper/sapien/a/libero.aspx,"101-02,101-03,101-11,101-12,101-12-01,101-13,102-01,102-02,102-03,103-01"
143,132,,,,"Nullam orci pede, venenatis non, sodales sed, tincidunt eu, felis. Fusce posuere felis sed lacus. Morbi sem mauris, laoreet ut, rhoncus aliquet, pulvinar sed, nisl. Nunc rhoncus dui vel sem.",,,Free,,,,,,Anser caerulescens,,,active,,https://hud.gov/vestibulum/aliquet/ultrices/erat/tortor/sollicitudin/mi.png,"101-02,101-03,101-11,101-12,101-12-01,101-13,102-01,102-02,102-03,103-01"
144,132,,,,In eleifend quam a odio. In hac habitasse platea dictumst. Maecenas ut massa quis augue luctus tincidunt. Nulla mollis molestie lorem. Quisque ut erat. Curabitur gravida nisi at nibh.,,,Fee Charged,,,,,,Rhea americana,,,active,,http://i2i.jp/elementum/ligula/vehicula/consequat/morbi.jpg,"101-02,101-03,101-11,101-12,101-12-01,101-13,102-01,102-02,102-03,103-01"
145,132,,,,In hac habitasse platea dictumst.,,,Free,,,,,,Ara macao,,,active,,https://smh.com.au/suspendisse/accumsan/tortor.json,"101-02,101-03,101-11,101-12,101-12-01,101-13,102-01,102-02,102-03,103-01"
146,133,,,,"Nunc purus. Phasellus in felis. Donec semper sapien a libero. Nam dui. Proin leo odio, porttitor id, consequat in, consequat ut, nulla.",,,Free,,,,,,Canis lupus,,,active,,http://i2i.jp/proin/eu/mi.png,"101-02,101-03,101-04,101-12,101-13,102-01,102-02,102-03,103-01"
147,134,,,,"Nulla neque libero, convallis eget, eleifend luctus, ultricies eu, nibh. Quisque id justo sit amet sapien dignissim vestibulum. Vestibulum ante ipsum primis in faucibus orci luctus et ultrices posuere cubilia Curae; Nulla dapibus dolor vel est.",,,Free,,,,,,Pseudocheirus peregrinus,,,active,,http://qq.com/proin/eu/mi/nulla/ac/enim/in.js,"101-02,101-03,101-04,101-12,101-13,102-01,102-02,102-03,103-01"
148,135,,,,Nullam varius. Nulla facilisi. Cras non velit nec nisi vulputate nonummy.,,,Free,,,,,,Cereopsis novaehollandiae,,,active,,https://mac.com/tristique/est/et/tempus/semper.aspx,"101-03,101-04,101-12,101-12-03,101-13,102-01,102-02,102-03,103-01"
